soru,cevap
Türkiye'de hayvan hastalıklarıyla mücadelede hangi sorun yaşanmaktadır?,Yeterli mücadele edilememektedir.
Türkiye'de tavukçuluk dışında hangi alanda işletme kapasiteleri düşüktür?,Hayvancılık alanında işletme kapasiteleri düşüktür.
"Türkiye'deki hayvansal üretim işletmeleri, hangi ülkelerin yetiştiricileriyle rekabet edecek güçte değildir?",AB ülkelerindeki yetiştiricilerle rekabet edecek güçte değildir.
Hayvancılıkta üretim maliyetlerinin en büyük payı hangi unsura aittir?,"Yemin fiyatı, hayvancılıkta üretim maliyetlerinin en büyük payına sahiptir."
Yem üretiminde hangi teknolojik gelişmeler AB ve ABD'de yaygın olarak kullanılmaktadır?,"Pelet yem üretimi, ekspender ve ekstruderler gibi teknolojiler AB ve ABD'de yaygın olarak kullanılmaktadır."
Türkiye'de yem fabrikalarının çoğunluğunda hangi altyapı eksiktir?,Basit analizleri yapacak laboratuvar altyapısı eksiktir.
Üretim yetersizliği nedeniyle hangi yem maddelerinin ithalatı zorunlu hale gelmiştir?,"Mısır, soya ve yem katkılarının ithalatı zorunlu hale gelmiştir."
Türkiye'de tarımda teknoloji kullanımının durumu nasıldır?,"Tarımda teknoloji kullanımı yeterli değildir, gıda alanında ise daha ileri ve yaygındır."
Su ürünleri üretiminde son yıllarda ne tür bir değişiklik gözlemlenmiştir?,Üretim artış hızı azalmış ve balık stokları zorlanmıştır.
Balıkçılığın ana girdilerini oluşturan balık türleri nelerdir?,"Hamsi, istavrit, kolyoz, palamut, mezgit, sardalya, lüfer, barbunya ve kefal."
2008 yılı için toplam su ürünleri üretiminin hangi aralıkta olması öngörülmektedir?,575-720 bin ton arasında değişeceği öngörülmektedir.
Yetiştiricilikten elde edilen üretim 2000 yılında ne kadardır?,"Yetiştiricilikten elde edilen üretim 79,031 tondur."
Türkiye'nin su ürünleri potansiyeli ne kadardır?,Türkiye'nin su ürünleri potansiyeli 26.2 milyon hektar yüzey alanına sahiptir.
Türkiye'de kişi başına su ürünleri tüketimi ne kadardır?,Kişi başına su ürünleri tüketimi 7-8 kg civarındadır.
Türkiye'de orman sayılan alanlar ülke yüzeyinin yüzde kaçını oluşturmaktadır?,Türkiye'de orman sayılan alanlar ülke yüzeyinin % 26.8'ini oluşturmaktadır.
Orman köylerinde gizli işsizlik oranı nedir?,Orman köylerinde gizli işsizlik oranı % 60'tır.
Türkiye'de orman yangınlarının en sık görüldüğü iklim bölgesi hangisidir?,Türkiye'de orman yangınlarının en sık görüldüğü iklim bölgesi Akdeniz ikliminin egemen olduğu alanlardır.
Orman alanlarının yüzde kaçı yangına hassas bölgelerde yer almaktadır?,Orman alanlarının % 58'i yangına hassas bölgelerde yer almaktadır.
Orman köylerindeki toplam nüfus kaç milyondur?,Orman köylerindeki toplam nüfus 7.4 milyon kişidir.
Türkiye'de ormanların işletilmesi ve korunmasıyla ilgili yasal düzenlemelerde ne tür boşluklar bulunmaktadır?,Ormanların işletilmesi ve korunmasıyla ilgili yasal düzenlemelerde ormanların amaç dışı kullanılmasına yönelik boşluklar bulunmaktadır.
Türkiye'de orman ürünleri ihtiyacı nasıl karşılanmaktadır?,Orman ürünleri ihtiyacı ağırlıkla yurt içinden karşılanmaktadır.
Ormancılık çalışmalarının verimlilik ve etkenlik düzeylerini yükseltmek için hangi unsurlar yetersiz kalmaktadır?,Ormancılık çalışmalarının verimlilik ve etkenlik düzeylerini yükseltmek için teknik ve teknolojiler yeterince kullanılamamaktadır.
Türkiye'de orman yangınlarıyla mücadelede kullanılan modern ekipmanlar nelerdir?,"Yangın kuleleri, müdahale ekipleri, telsiz, helikopter gibi modern ekipmanlar kullanılmaktadır."
Türkiye'nin tarımsal verimliliği istenilen düzeye neden getirilememiştir?,Sürdürülebilir tarım tekniklerinin yanında modern biyoteknoloji gibi yeni teknolojilerin geliştirilip uygulanamaması nedeniyle.
Türkiye'de tarımsal araştırmaların istenilen düzeyde olmamasının sebepleri nelerdir?,"Belirgin bilim-teknoloji politikalarının eksikliği, temel araştırmaların yetersiz oluşu, tarım eğitimindeki niteliğin düşmesi ve Ar-Ge faaliyetlerine ayrılan kaynakların düşüklüğü."
Son yirmi yılda Türkiye'de tarımsal nüfus oranı nasıl değişmiştir?,Tarımsal nüfus % 44.1’den % 36’ya gerilemiştir.
Türkiye'de erozyon sorunu son yirmi yılda nasıl bir gelişme göstermiştir?,"Erozyon sorunu büyümüş, ancak mücadele bilinci gelişmeye başlamıştır."
Türkiye'de son yirmi yılda organik tarımla ilgili hangi gelişmeler yaşanmıştır?,Organik tarım ile ilgili yönetmelik çıkarılmış ve organik ürünlerin üretimi artmıştır.
Son yirmi yılda Türkiye'de tarım eğitimi alanında hangi değişiklikler olmuştur?,"Ziraat, veteriner ve orman fakülteleri ile gıda mühendisliği bölümlerinin sayıları artmış, yeni su ürünleri fakülteleri açılmış, ancak eğitim düzeyinde yeterli iyileşme sağlanamamıştır."
Son yirmi yılda Türkiye'de ambalajlama alanında ne tür gelişmeler kaydedilmiştir?,Yeterli olmamakla birlikte ambalajlama alanında önemli gelişmeler kaydedilmiştir.
Türkiye'de çiftçi kayıt sistemi ve hayvan kimlik sistemi gibi uygulamalar ne zaman başlamıştır?,Son yirmi yılda başlamış ve önemli gelişmeler sağlanmıştır.
Türkiye'de tarımda kullanılan makine ve ekipmanlar konusunda ne tür gelişmeler yaşanmıştır?,Güncel teknolojiyle donatılmış makine ve ekipmanların ithalatı ile yeni teknolojilerle tanışılmış ancak yerli üreticiler bu teknolojileri henüz özümseyememişlerdir.
Türkiye'de son yirmi yılda tarımsal ürünlerde destekleme politikaları nasıl bir etki yaratmıştır?,"Şeker pancarı, tütün, çay, fındık ve kuru üzüm gibi ürünlerde arz fazlası oluşmuş, diğer tarımsal ürünler ve gıda sanayinde destek ve teşvikler azaltılmış, finansman ve kaynak kullanım sorunları çıkmıştır."
2001 yılında hangi tarım politikası değişikliği yapılmıştır?,Mevcut girdi destekleme politikalarından vazgeçilerek doğrudan gelir desteği sistemine geçilmiştir.
Çiftçi eğitimi konusunda ne durumdadır?,Çiftçi eğitimi konusunda yürütülen çalışmalar istenilen düzeye ulaşamamıştır.
Sulama konusunda ekonomik olarak sulanabilir alanların ne kadarı sulamaya açılmıştır?,Ekonomik olarak sulanabilir nitelikteki alanların %53'ü sulamaya açılmıştır.
Aşırı sulama ve kimyasal madde kullanımı hangi sorunları ortaya çıkarmıştır?,Önemli çevre ve sağlık sorunları ortaya çıkarmıştır.
Tarımda kullanılan makine ve kimyasal maddeler hangi boyutlara ulaşmıştır?,Gelişmiş ülkeler düzeyinde olmamakla birlikte önemli boyutlara ulaşmıştır.
Hangi tarım sektörü özelleşmiştir ve hangi yetiştiricilik türü gelişmiştir?,"Tohumculuk sektörü özelleşmiş, seracılık ve örtü altı yetiştiriciliği gelişmiştir."
Türkiye'de biyolojik mücadeleye yönelik hangi gelişme yaşanmıştır?,Entegre mücadelede bio-pestisit kullanımı başlamış ve biyolojik mücadele Türkiye gündemine girmiştir.
Hayvansal üretimde hangi uygulamalar sürdürülmüştür?,Damızlık hayvanların ıslahında melezleme çalışmalarına ilaveten döl kontrolü ve suni tohumlama uygulamaları sürdürülmüştür.
Sığır ve küçükbaş hayvan varlığında nasıl bir değişim olmuştur?,"Sığır ve küçükbaş hayvan varlığı azalmış, sığırlarda et ve süt verimi artarken küçükbaş hayvanlarda ilerleme sağlanamamıştır."
Tavukçuluk sektöründe hangi gelişmeler yaşanmıştır?,"Yetiştirme tekniklerindeki gelişmelerle verim iyileşmiş, entegre üretim yaygınlaşmış ve işletme kapasitesi artmıştır."
Kanatlı ve balık karma yem üretiminde hangi sorun yaşanmaktadır?,Balık unu kullanımı balık tüketimi açısından sorun teşkil etmektedir.
Et tüketiminde hangi et türünün tüketimi artış göstermiştir?,Tavuk eti tüketimi artış göstermiştir.
Arıcılıkta yapay tohumlama hangi amaçla kullanılmaya başlanmıştır?,Ana arı elde etmede yapay tohumlama kullanılmaya başlanmıştır.
Balıkçılıkta hangi teknolojik araçlar devreye girmiştir?,"Echo-sounder, sonar, radar gibi balık bulucu ve yön tayin edici araçlar devreye girmiştir."
Gıda sanayinde hangi tür ürünlerde ilerlemeler kaydedilmiştir?,"Dondurulmuş, kurutulmuş, hazır gıdalar, meyve suyu ve konsantresi, konserve, salça, et, süt ve ürünleri, tahıl ve ürünleri ile benzeri alanlarda ilerlemeler kaydedilmiştir."
Gıda sanayinin en önemli sorunları nelerdir?,Finansman ve kaliteli hammadde yetersizliği ve atıl kapasite en önemli sorunlar arasındadır.
Orman alanlarının ormancılık dışı kullanımını yaygınlaştıran ne tür düzenlemeler yapılmıştır?,Hukuksal düzenlemeler yapılmıştır.
Orman köylülerinin ekonomik durumlarının iyileştirilmesi için ne tür projeler uygulanamamıştır?,Ciddi kırsal kalkınma projeleri uygulanamamıştır.
Korunan alanlarda ne tür artışlar olmuştur?,Korunan alanlar sayı ve alan olarak önemli düzeyde artmıştır.
Göç olgusu hangi yönde devam etmiştir?,Orman köylerinden kentlere göç olgusu devam etmiştir.
Malthus'un teorisi neyi öngörüyordu?,"Malthus'un teorisi, nüfusun geometrik, üretimin ise aritmetik artış göstereceğini ve 20. yüzyılda insanların aç kalacağını öngörüyordu."
Günümüzde kaç milyon insan yetersiz beslenmektedir?,Günümüzde özellikle gelişmekte olan ülkelerde 800 milyon insan yetersiz beslenmektedir.
Mikroelement eksikliği problemi kaç milyar insanı etkilemektedir?,Yanlış ve yetersiz beslenme nedenli mikroelement eksikliği problemi 3 milyar insanı etkilemektedir.
Açlık ve besin yetersizliğinin nedenleri nelerdir?,"Açlık ve besin yetersizliğinde; üretim dağılımındaki dengesizlik, geri kalmış ülkelerdeki iç savaşlar nedeniyle tarımsal üretimin engellenmesi, tarımsal yatırımların yetersizliği ve toprakların ciddi bir degradasyon sürecinde olması gibi nedenler yatmaktadır."
Birleşmiş Milletler'e göre 2025 yılında dünya nüfusu kaç milyar olacaktır?,Birleşmiş Milletler tahminlerine göre 2025 yılında dünya nüfusu 8 milyara ulaşacaktır.
Nüfus artışlarının tamamına yakını hangi ülkelerde gerçekleşecektir?,"Nüfusta artışların tamamına yakınının (%96'sının), halen beslenme ve sağlık problemleri yaşayan ülkelerde gerçekleşeceği öngörülmektedir."
Artan nüfusun gereksinimini karşılamak için üretimde ne kadar artış gerekmektedir?,"Artan nüfusun gereksinimini karşılamak için, önümüzdeki 50 yıl içinde üretimde en az iki kat, tercihen 3 kat artış gerekmektedir."
Türkiye'de orman ağaçları ve tohumlarının ıslahı kapsamında hangi projeler başlatılmıştır?,"Orman ağaçları ve tohumlarının ıslahı kapsamında; tohum meşcerelerinin seçimi, türlere yaygınlaştırılması, bireysel seleksiyon tohum bahçelerinin kurulması konularında ulusal projeler başlatılmıştır."
Orman yangınlarında ne tür bir gelişme sağlanmıştır?,Orman yangınlarında yangın başına yanan ortalama alan genişliğinde azalmalar sağlanmıştır.
Orman ekosistemindeki odun dışı orman ürünlerinin ticaretinde ne tür bir değişiklik olmuştur?,"Orman ekosistemindeki odun dışı orman ürünlerinden (kekik, adaçayı, defne yaprağı, çam fıstığı, mantarlar, vb.) faydalanma ve bunların iç ve dış ticareti artmıştır."
Tahıl üretimi 1961 yılından 2001 yılına kadar ne kadar artmıştır?,Tahıl üretimi 1961 yılında 876 milyon tondan 2001 yılında 2.1 milyar tona ulaşmıştır.
Tahıl üretiminin 2025 yılında ne kadar olması beklenmektedir?,Tahıl üretiminin 2025 yılında 4 milyar tona ulaşması gerekmektedir.
Gıda güvenliğini tehdit eden olgulardan biri nedir?,Gıda güvenliğini tehdit eden olgulardan biri biyolojik çeşitliliğin azalma sürecine girmesidir.
Güney Asya'da 1970 yılından beri tahıl üretiminde ne kadar artış olmuştur?,Güney Asya'da 1970 yılından beri tahıl üretimi 4 kat artmıştır.
ABD'de 1900'lü yılların başında yetiştirilen mısır çeşitlerinin sayısı kaçtır?,ABD'de 1900'lü yılların başında yetiştirilen mısır çeşitlerinin sayısı 800'dür.
Bitkisel üretime uygun verimli topraklar neden azalmaktadır?,Artan nüfusla birlikte kişi başına düşen tarımsal alan miktarı azalmaktadır.
Dünya orman alanları 1980-1995 yılları arasında nasıl değişmiştir?,"Gelişmiş ülkelerde 20 milyon hektar artış gösterirken, gelişmekte olan ülkelerde 200 milyon hektarlık azalma olmuştur."
Hayvansal üretimde önümüzdeki 20 yıl içinde ne beklenmektedir?,Hayvansal üretimde de artış beklenmektedir.
2020 yılında et ihtiyacının ne kadar artacağı tahmin edilmektedir?,2020 yılında et ihtiyacının %58’lik bir artışla 327 milyon tona çıkacağı tahmin edilmektedir.
Biyoteknoloji hangi alanda kullanılmaya başlanmıştır?,Kalkınmış ülkeler karma yem sektöründeki ana hammaddelerin üretiminde biyoteknolojik yöntemleri kullanmaya başlamışlardır.
Gelişmiş ülkelerde tarımın ülke ekonomisindeki itici gücü hangi sektöre yerini bırakmıştır?,Endüstriye yerini bırakmıştır.
Gelişmiş ülkelerde tarımda çalışan nüfusun oranı ne kadar düşmüştür?,%5’ler düzeyine düşmüştür.
Gelişmiş ülkelerde tarımın GSYİH içindeki oranı nedir?,%5’ler düzeyine inmiştir.
Gen teknolojileri hangi alanlarda artan bir kullanım sürecine girmiştir?,Bitkisel ve hayvansal gıda üretimi ve geliştirilmesinde artan bir kullanım sürecine girmiştir.
Gelişmiş ülkelerin tarım alanında bilgi ve teknolojiye dayalı özelliklerinden biri nedir?,Bilgi ve teknoloji üreten ve ihraç edebilen.
Gelişmiş ülkelerde endüstri ve üniversite iş birliği hangi düzeydedir?,Gelişmiş düzeydedir.
Gelişmiş ülkelerde tarımsal yayım hizmetleri nasıl yapılmaya başlanmıştır?,İnternet üzerinden yapılmaya başlanmıştır.
Gelişmiş ülkelerde su kaynaklarını kullanacak teknoloji ve donanım nasıl olmalıdır?,Optimal biçimde kullanacak teknoloji ve donanıma sahip olmalıdır.
Gelişmiş ülkelerde kimyasal zirai mücadele ilaçlarının alternatiflerinin kullanımı nasıl bir gelişim göstermiştir?,"Daha etkin, çevre dostu, biyolojik preparatlar ve biyoteknolojik bitkisel materyaller geliştirilmiştir."
Gelişmiş ülkelerde hedeflenen teknolojilerin üretimi ve kullanımları ne ölçüde bellidir?,Büyük ölçüde bellidir.
Ormanlar hangi işlevlerini yeterli düzeyde yerine getirebilmiştir?,"Ormanlar ekolojik, ekonomik ve sosyal işlevlerini yeterli düzeyde yerine getirebilmiştir."
Biyoteknolojik yöntemler tarımsal üretimi artırmada hangi avantajları sağlamaktadır?,"Biyoteknolojik yöntemler, özellikle moleküler teknikler, tarımsal üretimi artırmada avantajlar sağlamaktadır."
Modern biyoteknolojiler hangi ülkelerde daha etkindir?,"Modern biyoteknolojiler, Çin ve Hindistan gibi birkaç gelişmekte olan ülke dışında gelişmiş ülkelerde etkindir."
Genom araştırmalarında son yıllarda hangi değişiklikler görülmektedir?,"Genom araştırmalarında, artık tek tek genlerin izole edilip tanımlanması yerine, tüm genlerin ya da gen gruplarının belirli bir organizma içerisindeki işlevlerini belirlemeye yönelik araştırmalar öne çıkmaktadır."
İlk transgenik ürün nedir ve ne zaman pazara sürülmüştür?,"İlk transgenik ürün, uzun raf ömürlü domates FlavrSavr olup, 1996 yılında pazara sürülmüştür."
Transgenik ürünlerin ekim alanlarının %99'u hangi ülkelerde bulunmaktadır?,"Transgenik ürünlerin ekim alanlarının %99'u ABD, Arjantin, Kanada ve Çin'de bulunmaktadır."
OECD 2000 yılı verilerine göre transgenik ürünlere ait kaç tarla denemesi yapılmıştır?,OECD 2000 yılı verilerine göre transgenik ürünlere ait 15.000'in üzerinde tarla denemesi yapılmıştır.
"Son yirmi yılda tarım, gıda ve ormancılık alanında hangi önemli gelişmeler yaşanmıştır?","Son yirmi yılda biyoteknoloji ve moleküler gen tekniklerinin uygulamaya girmesi, bilişim teknolojilerinin gelişmesi ve yayılması, savunma sanayi, havacılık, uzay ve elektronik alanlarında geliştirilen teknolojilerin tarım ve gıda alanında uygulamaya girmesi, küreselleşme ve sosyo-ekonomik sonuçları, sürdürülebilir tarım faaliyetlerinin geliştirilmesi gibi önemli gelişmeler yaşanmıştır."
Çevre duyarlılığının ön plana çıkması hangi alanda gelişmeler sağlamıştır?,"Çevre duyarlılığının ön plana çıkması, biyopreperatların kullanımının ve çeşitliliğinin artmasına, etkili mikroorganizmaların tarım ve gıda alanında kullanımının yaygınlaşmasına ve küresel ısınmanın çözümüne yönelik çalışmaların artmasına katkı sağlamıştır."
Uzaktan algılama sistemleri tarımsal üretimde nasıl kullanılmaktadır?,"Uzaktan algılama sistemleri, tarımsal üretimde bitki hastalıklarının önceden tahmini ve erken uyarı sistemlerinin devreye girmesi gibi amaçlarla kullanılmaktadır."
Küresel ısınmanın çözümüne yönelik hangi çalışmalar artmıştır?,Küresel ısınmanın çözümüne yönelik evsel ve endüstriyel atıkların biyolojik sistemlerle arıtılması ve kuraklığa ve tuza dayanıklı bitki çeşitlerinin geliştirilmesi gibi çalışmalar artmıştır.
Hayvancılıkta biyoteknolojik yaklaşımlar hangi alanlarda devreye girmiştir?,"Hayvancılıkta biyoteknolojik yaklaşımlar, hastalıklara dayanıklılık, cinsiyet ayrımı ve cinsiyetin tayini, yumurtada bileşimi değiştirmeye yönelik girişimler gibi alanlarda devreye girmiştir."
Dünya et üretiminde hangi değişiklikler gözlemlenmiştir?,"Dünya et üretiminde tavuk etinin payı artarken, sığır ve koyunun payı azalmış, domuz ve keçi eti üretiminde ise değişme olmamıştır."
Hayvancılıkta genotipin çözümlenmesini hedefleyen çalışmaların önemi nedir?,"Genotipin çözümlenmesini hedefleyen çalışmalar, hayvancılıkta hastalık etmenlerini kısa sürede tespit etmeye ve üretim tekniklerinde kalite değişimi sağlamaya olanak tanımaktadır."
Yem bileşimindeki değişimlerin amacı nedir?,Yem bileşimindeki değişimlerle yemin sindirilebilirliğinin yükseltilmesine yönelik teknolojiler geliştirilmiş ve karma yem üretimi ile kalitesi artırılmıştır.
İnsan sağlığı konusundaki hassasiyetin artması hayvancılıkta hangi uygulamayı etkilemiştir?,"İnsan sağlığı konusundaki hassasiyetin artması, karma yemde antibiyotik kullanımının kısıtlanmasına neden olmuştur."
Gelişmiş ülkelerdeki çok ortaklı firmalar pazarlama yapacakları ülkelerde nasıl bir strateji izlemektedir?,"Gelişmiş ülkelerdeki çok ortaklı firmalar, pazarlama yapacakları ülkelerde elde ettikleri teknoloji ürünlerini doğrudan üreterek pazar garantisi sağlamaktadır."
1970 yılından önce milli sınırlar dışında kalan denizler nasıl kabul edilmiştir?,"1970 yılından önce milli sınırlar dışında kalan denizler, avcılığın serbestçe yapılabildiği yerler olarak kabul edilmiştir."
Münhasır Ekonomik Bölge nedir ve hangi tarihten sonra belirlenmiştir?,"Münhasır Ekonomik Bölge, okyanus ve denizlere kıyısı olan ülkelerin 200 mil sınırları içinde avlanmak ve tabii kaynakların kullanılması üzerinde kontrol sahibi olduğu bölgedir ve 1970 yılından sonra belirlenmiştir."
Su ürünleri yetiştiriciliği 1990 ve 2000 yılları arasında nasıl bir değişim göstermiştir?,Su ürünleri yetiştiriciliği 1990 yılında 13.1 milyon tondan 2000 yılında 35.6 milyon tona çıkmıştır.
Avcılık teknolojisinde çevre bilinci nedeniyle ne tür değişiklikler yapılmıştır?,"Çevre bilinci nedeniyle su kaynaklarının temiz tutulması, av araçlarının avlanabilir özellikte olmayan tür ve bireyleri avlamayacak biçimde düzenlenmesi, tabii kaynakların takviye edilmesi ve stokları azalmış türlerin rehabilitasyonu ön plana çıkmıştır."
Gelişmekte olan ülkelerde sanayileşme uğruna hangi kaynaklar gözden çıkarılmıştır?,Gelişmekte olan ülkelerde sanayileşme uğruna tabii kaynaklar gözden çıkarılmıştır.
Ormanların korunması konusunda hangi kavramlar gündeme gelmiştir?,Ormanların korunması konusunda sürdürülebilir ormancılık ve sürdürülebilir orman yönetimi kavramları gündeme gelmiştir.
Uluslararası sözleşmelerin ormanlar üzerindeki etkileri nelerdir?,"Uluslararası sözleşmeler, ormanların küresel karbon döngüsüne katkılarının artırılmasına, orman koruma sistemlerinin çeşitlendirilmesine, orman ekosistemlerinin korunmasına ve daha birçok alanda işbirliğine yol açmıştır."
2023 yılında Türkiye'nin nüfusu ne kadar olacaktır?,2023 yılında Türkiye'nin nüfusunun yaklaşık 80-85 milyon olması beklenmektedir.
Tarım ve gıda sektöründe genetik alanda ne tür gelişmeler beklenmektedir?,"Önemli bazı bitki, hayvan ve mikroorganizmaların genetik şifreleri çözümlenecek, genetik orijinleri tanımlanacak, gen fonksiyonları belirlenecek, önemli genler klonlanacak ve biyotik ve abiyotik stres koşullarına dayanıklı yüksek verimli ve kaliteli üretime yönelik iyileştirmeler yapılacaktır."
Nanoteknolojilerin tarım ve gıda sektöründe nasıl bir rolü olacaktır?,Nanoteknolojiler tarım ve gıda üretiminde uygulanacak ve üretimde robotlar kullanılacaktır.
Uzayda hangi tür materyallerin üretileceği öngörülmektedir?,Uzayda bazı bitki ve mikroorganizma materyalleri üretilecektir.
Beslenme alışkanlıkları ve kültüründe ne tür değişiklikler beklenmektedir?,Beslenme alışkanlıkları ve kültürü değişecektir.
Gelişmekte olan ülkelerde hangi konular gündemin ilk sıralarına oturacaktır?,Su ve toprak ilişkileri gelişmekte olan ülkelerde gündemin ilk sıralarına oturacaktır.
Küresel ısınmanın enerji üretimi üzerindeki etkisi ne olacaktır?,Küresel ısınmayla artan güneş enerjisi kullanılabilir enerji formuna dönüştürülebilecektir.
Çevre bilinci ve doğal kaynakların korunması konusunda ne tür gelişmeler beklenmektedir?,"Çevre bilinci yaygınlaşacak ve doğal kaynaklar korunacak, atıkları yeni ürünlere dönüştüren yöntemler geliştirilecek, yayım ve eğitim çalışmaları hız kazanacaktır."
Tarımda bilişim ve mobilişim teknolojilerinin rolü ne olacaktır?,Tüm süreçlerde bilişim ve mobilişim teknolojileri önemli ve etkili rol oynayacaktır.
Su ürünleri üretiminde nasıl bir değişim öngörülmektedir?,"Su ürünleri üretimi artacak, deniz ve iç sulardan üretimde daha fazla yararlanılacaktır."
Tarımsal üretimin gelecekteki coğrafi dağılımı nasıl değişecek?,Tarımsal üretimin önemli bir kısmı gelişmiş ülkelerden diğer ülkelere kayacak.
Yerel mutfak kültürlerinin uluslararası pazarlarda nasıl bir fırsatı olacak?,Uluslararası gıda güvenliği standartlarında yerel ve uluslararası pazarlarda markalaşma fırsatı doğacak.
Artan nüfusun beslenmesi için ne tür bir üretim sürdürülecek?,Artan nüfusun beslenmesi için yoğun üretim kaçınılmaz olarak sürdürülecek.
Organik tarımın gelecekteki durumu nasıl olacak?,Organik tarım bir grup tüketicinin talebini karşılamak amacıyla daha fazla gelişecek.
Hayvan hakları ve refahı nasıl bir güvence altına alınacak?,Hayvan refahı ve hayvan hakları güvence altına alınacak.
Fosil enerjiye alternatif olarak ne tür çalışmalar yapılacak?,Bitki türlerinden enerji elde etmek için çalışılacak.
Su kaynakları üzerindeki aşırı kullanma baskısının sonucu ne olacak?,Tatlı su kaynaklarında çok önemli kısıntılar olacak ve bitki su tüketimi daha etkin biçimde ölçülüp denetlenecek.
Tarımsal alanda bilgisayar kullanımı ve otomasyon nasıl etkilenecek?,"Bilgisayar kullanımı ve otomasyon düzeyi yükselecek, bilgi toplama ve değerlendirmenin hızı artacak, maliyeti düşecek."
Hangi hammaddelerin önemi ve üretimi artacak?,"Soya, mısır gibi hammaddelerin önemi ve üretimleri giderek artacak."
Kimyasal kökenli girdilerin yapıları nasıl değişecek?,Kimyasal kökenli girdilerin yapıları biyolojik kökenli olanlara doğru değişecek.
Yem değerlendirmeyi iyileştirmek için neler yapılacak?,"Uygun yöntem ve madde arayışı devam edecek, hayvan sağlığı üzerindeki çalışmalar arttırılacak."
Nesli azalmakta olan türlerin korunması için ne yapılacak?,Daha hassas olunacak.
Tatlı su kaynakları üzerinde ne tür baskılar artacak?,Uluslararası baskılar artacak.
Gıda endüstrisinde hangi tür teknolojiler tercih edilecek?,Besin elamanlarını daha az tahrip eden çevre dostu teknolojiler kullanılacak.
Ambalaj materyalleri konusunda ne gibi değişiklikler olacak?,Biyolojik olarak parçalanabilir ambalaj materyalleri sentetik olanlarla yer değiştirecek.
Tarımsal ürünlerin üretiminde hangi özellikler ön plana çıkacak?,Daha az hacimde daha yüksek besleyici değerde üretilebilecek.
Akıllı mutfak donanımlarının yaygınlaşmasının etkisi ne olacak?,Gıdaların hazırlanış biçimleri üzerinde etkisi olacak.
Fermente gıdaların üretiminde hangi teknolojiler kullanılacak?,Yüksek reaksiyon hızına sahip modifiye enzimler kullanılması yoluyla kısa sürelerde elde edilmesini sağlayan teknolojiler.
Gıdaların hijyenik kalitesi nasıl artırılacak?,Biyosensörler ve çok amaçlı enzimlerden yaygın ve etkin bir biçimde yararlanılacak.
