soru,cevap
"Fiyat desteği, teşvik primleri ve kredi desteği hangi yıldan sonra sıfırlanmıştır?",2003 yılından sonra hemen hemen sıfırlanmıştır.
2003 ve 2004 yıllarında gündeme gelen girdi desteği nedir?,2003 ve 2004 yıllarında DGD şeklinde verilen motorin desteği girdi desteği olarak gündeme gelmiştir.
Dünya Bankası'nın 18 Şubat 2005'te yayınlanan raporunda tarımsal destekler bütçesindeki düşüş ne kadar olarak belirtilmiştir?,Tarımsal destekler bütçesinde 5.4 milyar Dolardan 0.7 Dolara bir düşüş sağlandığı belirtilmiştir.
Doğrudan Gelir Desteği'nin (DGD) temel amacı nedir?,Piyasaya etkisinin en az olması ve uluslararası ticaretin serbestleşmesine katkıda bulunmasıdır.
Türkiye'de DGD uygulamasının ana hedeflerinden biri nedir?,Üretim faktörleri için gerekli finansmanın doğrudan üreticilere ulaştırılmasıdır.
"DGD uygulamasının Türkiye'deki hedeflerinden biri, piyasalara müdahalelerin azaltılması ve fiyatların nasıl oluşmasını sağlamaktır?",Fiyatların serbest piyasada oluşmasının sağlanmasıdır.
Türkiye'de DGD uygulamasının Avrupa Birliği'ne uyum için sağladığı katkı nedir?,Ülke genelinde üretici kayıtlarının doğru alınması ve bu kayıtların güncellenerek sağlıklı tarım politikalarının oluşturulması ile Avrupa Birliği'ne uyum için gerekli zeminin hazırlanmasıdır.
DGD kavramı Türkiye'de ilk defa ne zaman ve hangi çerçevede yer almıştır?,"DGD kavramı, Türkiye’de ilk defa 1990’lı yılların ikinci yarısında VIII. Beş Yıllık Kalkınma Planında ve ARIP projesi çerçevesinde yer almıştır."
DGD uygulamaları hangi yıllarda ülke genelinde uygulanmıştır?,"DGD uygulamaları 2001, 2002, 2003 ve 2004 yıllarında ülke genelinde uygulanmıştır."
2004 yılında prim ödemeleri hangi ürünlere yapılmıştır?,"2004 yılında prim ödemeleri pamuk, ayçiceği, zeytinyağı, soya, kanola ve mısır'a yapılmıştır."
Pamuk üretiminde prim ödemeleri neden kaçınılmaz hale gelmiştir?,Türkiye'nin pamuk kullanımında %50 oranında dışa bağımlı olması nedeniyle pamuk üretiminin devamlılığı için prim ödemesi kaçınılmaz hale gelmiştir.
DGD uygulamalarında 2003 yılında hangi yeni bilgiler toplanmıştır?,"2003 yılında DGD uygulamalarında çiftçi, arazi ve ürün bilgileri toplanmıştır."
2001 yılında DGD kapsamında çiftçi sayısı kaç milyondur?,2001 yılında DGD kapsamında çiftçi sayısı 2.18 milyondur.
Prim ödemelerinin üretim miktarına etkisi nasıl olmuştur?,"Prim ödemeleri, üretim miktarı ve ekim alanlarında istenen artışı sağlamamış, ancak üretim miktarının belirli düzeyde tutulmasında etkili olmuştur."
Ayçiçeği üreticilerine neden prim ödenmesi gerekli görülmektedir?,"Ayçiçeği üreticilerine prim ödenmesi, Türkiye'nin yağlı tohumlar tüketiminde dışa bağımlı olması ve ayçiçeği üretiminde açığın giderilmesi için gerekli görülmektedir."
Soya fasulyesi üreticilerine prim ödenmesinin nedeni nedir?,"Soya fasulyesi üreticilerine prim ödenmesi, yağlı tohumlar tüketiminde ve yem sanayinde dışa bağımlılığın azaltılması için zorunlu görülmektedir."
Kanola üreticilerine prim ödemesi nasıl yapılmaktadır?,"Kanola üreticilerine prim ödemesi, üreticinin eline geçmesi gereken fiyat ile uluslararası borsalarda aynı dönemde oluşan fiyat arasındaki farkın ödenmesi şeklinde yapılmaktadır."
Zeytinyağı üreticilerine prim verilmesinin amacı nedir?,"Zeytinyağı üreticilerine prim verilmesinin amacı, üretici maliyetlerinin karşılanması, gelir düzeyinin korunabilmesi, üretimin teşvik edilmesi ve sanayiciye dış piyasa fiyatı düzeyinden hammadde temin edilmesidir."
Süt teşvik primi uygulamasının amacı nedir?,"Süt teşvik primi uygulamasının amacı, süt üreticisinin gelir seviyesinin yükseltilmesi, çiğ sütün modern tesislerde hijyenik olarak işlenmesi ve halkın daha kaliteli süt ürünleri tüketmesini sağlamaktır."
Soy kütüğüne kayıtlı hayvan sahiplerine ne kadar süt teşvik primi ödenmektedir?,Soy kütüğüne kayıtlı hayvan sahiplerine 40 bin TL süt teşvik primi ödenmektedir.
Trakya bölgesinde hastalıktan ari sağlık sertifikası alan işletmeler için süt teşvik primi nasıl uygulanmaktadır?,Trakya bölgesinde hastalıktan ari sağlık sertifikası alan işletmelerden elde edilen süt için %50 oranında ilave süt teşvik primi ödenmektedir.
İlk süt teşvik priminin başladığı yıllarda süt işleyen tesislerin sayısı kaçtı?,1357 adet.
2003 yılında süt işleyen tesislerin kurulu kapasitesi ne kadar olmuştur?,Yaklaşık 8 milyon ton/yıl.
İlk et teşvik primi uygulaması hangi tarihte sona ermiştir?,Ocak 1995.
2004 yılında et teşvik primi hangi hayvan yetiştiricilerine verilmektedir?,190 kg karkas ağırlığı üzerindeki sığır cinsi erkek hayvan yetiştiricilerine.
Et teşvik primi ödemesi hangi yerlerde kesilen hayvanlar için yapılmaktadır?,Bakanlıktan ruhsatlı kombina veya mezbahalarda kesilen hayvanlar için.
DTÖ Genel Konsey Taslak Kararı sonuçları ile ilgili en önemli problem nedir?,Bu politikaların DTÖ kararlarıyla uyumlu olması gerekliliğidir.
Alternatif Ürün Desteği kapsamında hangi ürünlerin üretimi artmıştır?,Fındık ve tütün.
Türkiye'nin yıllık fındık üretimi ne kadardır?,550 bin ton civarındadır.
Fındıkta alternatif ürün projesi hangi bölgede uygulanmaktadır?,Karadeniz bölgesinde uygulanmaktadır.
Alternatif ürün projesinden yararlanan fındık üreticilerine ne kadar ödeme yapılması planlanmıştır?,"Dekara 65 dolar söküm, 135 dolar girdi-bakım-hasat ödemesi olmak üzere toplam 200 dolar ödenmesi planlanmıştır."
Tütünde alternatif ürün projesi hangi bölgelerde uygulanmaktadır?,Doğu ve Güney Doğu Anadolu Bölgelerinde uygulanmaktadır.
Tütün üreticilerine alternatif ürün projesi kapsamında dekara ne kadar ödeme yapılmaktadır?,Dekara 80 dolar ödeme yapılmaktadır.
Alternatif ürün olarak önerilen bazı bitkiler nelerdir?,"Buğday, ayçiçeği, kanola, kuru fasulye, nohut, kırmızı mercimek, pamuk, fiğ, korunga, bağ, meyve, sebze, sera, aromatik ve tıbbi bitkiler önerilmektedir."
Tütün üretim alanlarının ne kadarlık kısmında alternatif ürün yetiştirilmesi hedeflenmiştir?,Toplam 36 bin hektar alanın 9 bin hektarlık kısmında alternatif ürün yetiştirilmesi hedeflenmiştir.
Şeker pancarında alternatif ürün projesi kapsamında hangi endişeler dile getirilmektedir?,"Üreticilerin kotalarını kaybetme endişesi, alternatif ürünleri pazarlama endişesi, hibe ödemesinin tek yıl olması ve 2002 yılı hibe ödemelerinin gecikmesi gibi endişeler dile getirilmektedir."
Şeker Pancarı Kotaları ve Telafi Edici Ödeme Uygulama Protokolü ne zaman imzalanmıştır?,01.04.2003 tarihinde imzalanmıştır.
2003/2004 pazarlama yılında Türkiye'de kaç milyon ton pancar kotası dağıtılmıştır?,"10,3 milyon ton pancar kotası dağıtılmıştır."
2003 yılı şeker pancarı üretimi kotalarının daraltılmasıyla hangi alternatif ürünlere ödeme yapılması öngörülmüştür?,"Mısır ekimi için dekara 132 milyon TL, ayçiçeği ekimi için 126 milyon TL, soya fasulyesi ekimi için 116 milyon TL ve yem bitkisi ekimi için 94 milyon TL ödeme yapılması öngörülmüştür."
İl Şekerpancarı Komisyonu kararlarına göre kaç dekar alanda telafi edici ekilişler yapılmıştır?,Yaklaşık 36 bin dekar alanda telafi edici ekilişler yapılmıştır.
Hayvancılığın Desteklenmesi Hakkında Bakanlar Kurulu Kararı hangi yılları kapsamaktadır?,2000-2004 yıllarını kapsamaktadır.
Sertifikalı düve satın alan şahıslara ne kadar destekleme ödemesi yapılmaktadır?,"Saf ırk sertifikalı düvelere 200 Milyon TL/baş, damızlık sertifikalı düvelere 400 Milyon TL/baş destekleme ödemesi yapılmaktadır."
Suni tohumlama belgesi alan kişilere hangi koşulda destek ödemesi yapılmaktadır?,Hayvanına yetkili veteriner hekim ve tüzel kişilerce suni tohumlama yaptırarak suni tohumlama belgesini alan kişilerin müracaatlarında her hayvana bir kez olmak şartıyla 7.5-15 Milyon TL suni tohumlama destek ödemesi yapılmaktadır.
Ön soykütüğü ve soykütüğüne kayıtlı hayvanlarına suni tohumlama yaptırarak buzağı alan yetiştiricilere ne kadar destek ödemesi yapılmaktadır?,"Her buzağı için bir kez olmak üzere, 30-60 Milyon TL/buzağı destek ödemesi yapılmaktadır."
Kalkınmada öncelikli illerde suni tohumlama ekibi kuran kişilere ne kadar destekleme primi ödemesi yapılmaktadır?,2.250 milyon TL destekleme primi ödemesi yapılmaktadır.
Ana arı satın alarak kullanan üreticilere ne kadar destekleme ödemesi yapılmaktadır?,"Ana arı başına 5 milyon TL, Arı Yetiştiriciliği Birliği üyesi olması halinde ise ana arı başına 10 milyon TL doğrudan destek ödemesi yapılmaktadır."
Hayvancılık desteklemeleri kapsamında 2005 yılında öngörülen toplam ödeme miktarı nedir?,516.245 bin YTL
AB’ye uyum sürecinde Türkiye için hangi tarihte Ulusal Fon akredite edilmiştir?,8 Ekim 2003
AB’ye uyum sürecinde Türkiye’ye kaç milyar Euro fon aktarılması planlanmıştır?,2006 yılına kadar toplam 1 Milyar Euro
Destekleme fonunun kaynakları arasında neler bulunmaktadır?,"Gümrük vergileri, tarım ürünleri ithalatından alınan vergiler, şeker ve glikoz vergileri, katma değer vergisi ve gayri safi milli hasıla katkısı bulunmaktadır."
Türkiye'de destekleme politikalarının harcama kalemlerinin belirlenmesinde hangi faktörler dikkate alınmalıdır?,Tarım sektörünün problemleri ve ihtiyaçları dikkate alınmalıdır.
AB'deki ödeme kurumlarının ana görevi nedir?,Üye ülkelerde OTP’nin yürütülmesi için ayrılan finansmanın kullanılmasını sağlamaktır.
Türkiye tarımının çözülmesi gereken yapısal problemleri nelerdir?,"Verimlilik, ekonomik olmayan işletme büyüklükleri, kırsal alanda çalışan işgücü fazlalığı, çiftçilerin yeterince örgütlenememesi ve bölgeler arası dengesizlikler gibi problemler."
Türkiye’de destekleme politikaları hangi kurumlar tarafından yürütülmektedir?,"TMO, TKK, TCZB ve TSKB gibi kurumlar tarafından yürütülmektedir."
Destekleme politikalarının karar mekanizmaları nasıl oluşturulmalıdır?,AB’deki 'Ödeme Kurumlarına' benzer bir şekilde Tarım Bakanlığı içerisinde oluşturulmalıdır.
AB bütçesinden hangi alanlara kaynak aktarımı hızlı bir şekilde artmaktadır?,"Verimlilik, ekonomik olmayan işletme büyüklükleri, kırsal alanda çalışan işgücü fazlalığı, çiftçilerin yeterince örgütlenememesi ve bölgeler arası dengesizlikler gibi alanlara kaynak aktarımı artmaktadır."
DTÖ çerçeve metni ne zaman kabul edilmiştir?,30 Temmuz 2004 tarihinde kabul edilmiştir.
DTÖ çerçeve metninin temel taşları nelerdir?,"Serbest ticareti bozucu nitelikteki tarımsal desteklerin azaltılması, ihracat teşviklerinin kaldırılması ve gümrük vergilerinin azaltılmasıdır."
Gelişme Yolundaki Ülkelere (GYÜ) hangi ayrıcalıklar tanınmıştır?,Serbestleşme tedbirlerini daha az oranda ve daha fazla sürede yapma ayrıcalığı tanınmıştır.
Türkiye hangi DTÖ sınıflamasında yer almaktadır?,"Türkiye, Gelişme Yolundaki Ülkeler (GYÜ) grubunda yer almaktadır."
Kırmızı kutu tedbirleri için Türkiye'nin ek yükümlülük altına girmesi hangi durumda söz konusu olabilir?,Asgari destek istisnasının %10’un altına çekilmesi halinde söz konusu olabilir.
Mavi kutu tedbirleri hangi ürünleri kapsamaktadır?,Fındık ve tütünde uygulanmakta olan alan daraltması ve çay budama tazminatlarını kapsamaktadır.
Türkiye'nin mavi kutu tedbirleri kapsamında gelecekte karşılaşabileceği kısıtlama nedir?,"Eğer 'Fark Ödeme' sistemini uygularsa, en yüksek destek değerinin %10’un altına çekilmesi kısıtlayabilir."
Yeşil kutu tedbirleri hangi alanları kapsamaktadır?,"Yeşil kutu tedbirleri, kırsal kalkınma, gıda güvencesi, altyapı yatırımları ve genel hizmetler gibi destekleri kapsamaktadır."
Tarım Stratejisi belgesi hangi yılları kapsamaktadır?,Tarım Stratejisi belgesi 2006-2010 yıllarını kapsamaktadır.
Tarım Stratejisi belgesinin hazırlanmasında hangi uluslararası gelişmeler dikkate alınmıştır?,Tarım Stratejisi belgesi hazırlanırken DTÖ'deki muhtemel gelişmeler dikkate alınmıştır.
Türkiye'nin tarım ürünleri ihracatı için sağladığı teşvikler ne düzeydedir?,Türkiye'nin tarım ürünleri ihracatı için sağladığı teşvikler çok düşük miktarlarda kalmaktadır.
Tarım Kanunu hangi yıl hazırlanmıştır ve ne zaman çıkması muhtemeldir?,Tarım Kanunu 2004 yılında hazırlanmıştır ve 2005 yılında çıkması muhtemeldir.
Tarım Stratejisi belgesinin temel amacı nedir?,"Tarım Stratejisi belgesinin temel amacı, kaynakların etkin kullanımı ilkesi çerçevesinde ekonomik, sosyal, çevresel ve uluslararası gelişmeleri bütün olarak ele alan örgütlü, rekabet gücü yüksek, sürdürülebilir bir tarım sektörü oluşturmaktır."
Tarım Stratejisi belgesi hangi uluslararası birliğe uyumu gözetmektedir?,"Tarım Stratejisi belgesi, Avrupa Birliğine uyumu gözetmektedir."
Stratejik amaçlardan biri nedir?,Sürdürülebilirlik ilkesi çerçevesinde kaliteye dayalı üretim artışı ile gıda güvenliği ve gıda güvencesinin sağlanması.
Üreticilerin rekabet düzeylerinin yükseltilmesi için hangi tedbirler alınacaktır?,Üretim maliyetlerini azaltıcı ve teknolojik gelişimi hızlandırıcı tedbirler uygulamaya konulacaktır.
Tarımsal pazarlama altyapısının iyileştirilmesi için ne tür tedbirler alınacaktır?,"Üreticilerin pazara erişim düzeylerinin artırılması, tarım-sanayi entegrasyonunun geliştirilmesi ve işleme sanayinin rekabet edebilirliğini artırıcı nitelikte uygun ve kaliteli ham maddenin temin edilmesi ile tüketici tercihlerinin karşılanması amacına yönelik tedbirler alınacaktır."
Kırsal kalkınma projeleri hangi yaklaşıma dayalı olarak oluşturulacaktır?,Üreticilerin katılımını ve sorumluluğunu esas alan ve doğrudan üreticilere finansman sağlayan yaklaşıma dayalı olarak oluşturulacaktır.
Tarımsal üretici birliklerinin kurulması ne amaçla yapılacaktır?,"Kamudan bağımsız bir yapıda üreticilere, üretimden pazarlamaya kadar olan safhalarda hizmet vermek üzere kar amacı gütmeyen tarımsal üretici birliklerinin kurulması ve geliştirilmesi amaçlanmaktadır."
Temel ilkelerden biri nedir?,Avrupa Birliği Ortak Tarım ve Balıkçılık Politikalarına Uyum ve Dünya Ticaret Örgütü Tarım Anlaşması esas alınacaktır.
Tarımsal destek yöntemlerinin uygulanmasında hangi esaslar alınacaktır?,"Ekonomik ve sosyal etkinliğin yanı sıra, bölgeler arası gelişmişlik farklılıklarının giderilmesi, sektörel sürdürülebilirlik ve gıda güvencesinin sağlanması esas alınacaktır."
Tarımsal destekleme araçları nelerdir?,"Tarımsal destekleme araçları; Doğrudan Gelir Desteği (DGD) Ödemeleri, Fark Ödemeleri, Hayvancılık Destekleri, Çevre Amaçlı Tarımsal Alanların Korunması (ÇATAK) Programı Destekleri, Telafi Edici Ödemeler, Ürün Sigortası Ödemeleri, Kırsal Kalkınma Destekleri ve diğer desteklerdir."
Doğrudan Gelir Desteği (DGD) ödemeleri hangi kriterlere göre yapılır?,DGD ödemeleri tarımsal üretim amacıyla işlenen araziler üzerinden her yıl tespit edilen birim ödeme miktarı (dekar başına TL) üzerinden yapılır.
Sera üreticileri ve meyve-sebze yetiştiricileri DGD uygulamalarına dahil midir?,"Hayır, sera üreticileri ve meyve-sebze yetiştiricileri DGD uygulamalarının dışında tutulur ancak kırsal kalkınma destek ve ÇATAK programına dahil edilir."
Fark Ödeme uygulamasının amacı nedir?,Fark Ödeme uygulamasının temel amacı arz açığı olan ürün yetiştiricilerini desteklemektir.
Hayvancılık desteklerinin kapsamı nedir?,"Hayvancılık destekleri, ırk ıslahı, kaba yem üretiminin artırılması, verimliliğin artırılması, işletmelerin ihtisaslaşması, hijyen şartlarının sağlanması, hayvan sağlığı ve refahı gibi alanları kapsar."
Hayvancılık desteklerinin tarım destekleme bütçesi içindeki hedeflenen payı nedir?,Hayvancılık desteklerinin tarım destekleme bütçesi içindeki payının %12 seviyesine yükselmesi hedeflenmektedir.
Su ürünleri üretiminin artırılması için hangi desteklemeler yapılacaktır?,"Su ürünleri üretiminin artırılması amacıyla, içsu ve deniz balıkçılığının geliştirilmesi, avcılığın kontrolü ve desteklenmesi, işletmelerin kurulması ve modernizasyonu, su ürünleri işleme tesislerinin iyileştirilmesine yönelik desteklemeler yapılacaktır."
Kırsal kalkınma programlarının temel ilkeleri nelerdir?,"Katılımcılık, tabandan yukarı yaklaşım, yerel kapasitenin geliştirilmesi ve kurumsallaşması."
Kırsal kalkınma yardımları hangi alanları kapsar?,"Çiftçi ve çiftçi grupları tarafından yapılan köy bazlı yatırımlar, kırsal yayım hizmetleri, arazi toplulaştırma, mikro-finans faaliyetleri, kadın ve dezavantajlı gruplara yönelik programlar."
Telafi edici ödemelerin amacı nedir?,Üreticilerin arz fazlası olan ürünlerden vazgeçerek alternatif ürünlere yönelmeleri durumunda gelir kayıplarını telafi etmek ve aşırı arz problemlerini önlemek.
Ürün sigortası ödemelerinde devletin karşılayacağı prim destek oranı nedir?,Azami yüzde 50 ile sınırlandırılacaktır.
ÇATAK Program Desteği'nin amacı nedir?,"Erozyon ve olumsuz çevresel etkilere maruz kalan tarım arazilerinde doğal bitki örtüleri, çok yıllık yem bitkileri, organik tarım ve ağaçlandırma gibi yöntemleri teşvik etmek."
Diğer destekler kapsamında hangi araçlar kullanılacaktır?,"Rekabete dayalı araştırma hibeleri, ihracat teşvikleri, bazı girdi destekleri ve kredi destekleri."
Tarımsal destekleme ödemelerinde hangi sistemler esas alınacaktır?,Çiftçi Kayıt ve Hayvan Kayıt Sistemleri.
Tarımsal destekleme bütçesi içerisindeki en yüksek pay hangi destekleme aracına aittir?,"DGD Ödemeleri, %45 ile en yüksek paya sahiptir."
"Bakanlar Kurulu, tarımsal destekleme araçlarının bütçe içindeki paylarını hangi oranlarda değiştirebilir?",± %25 oranında değiştirebilir.
Tarımsal destekleme bütçesi kapsamı dışında kalan harcamalar nelerdir?,Altyapı yatırımları ve cari tarımsal harcamalar.
Tarımsal destekleme ödemelerinin farklı miktarlarda yapılmasında hangi plan ve programlar esas alınacaktır?,Kalkınma Planları ile Yıllık Programlar.
"Tarımsal destekleme ödemelerinin gerekçesi, hedef kitlesi, ödeme biçimi ve zamanlaması nerede belirtilecektir?",İlgili mevzuatta belirtilecektir.
Destekleme ödemelerinde hangi kriterler dikkate alınacaktır?,"Kalite, standart ve hijyen kriterleri."
Tarım sektörünün en önemli problemlerinden biri nedir?,Üreticilere belirli bir pazar ve gelir garantisi sağlanamamasıdır.
Hedef fiyat ve fark ödeme sistemi hangi koşullarda daha etkili olabilir?,"Vergi gelirleri ile beslenen güçlü bir kamu maliyesi, tarımda ayrıntılı bir kayıt sistemi, üretici örgütlenmesi, teknolojik olgunluk, rekabetçi girdi piyasaları ve ürün borsaları gibi yapısal, kurumsal ve hukuki koşulların oluşması durumunda daha etkili olabilir."
Sözleşmeli tarımın çiftçilere ve sanayicilere sağladığı faydalar nelerdir?,"Çiftçilere ürünlerine pazar garantisi sağlarken, sanayicilere hammadde teminini garanti altına alır."
Tarım danışmanlığı desteği neden önemlidir?,Çiftçilerin üretim yapabilmesi için danışmanlık hizmeti ihtiyacı ortaya çıkmıştır ve doğru yerden bilgi alma ihtiyacı vardır.
"Hedef fiyat ve fark ödeme sistemi, tüketici refahını nasıl etkiler?",Tüketiciye düşük fiyatlarda ürün sunulmasını sağlar ve dünya piyasa fiyatlarına uyumu kolaylaştırır.
Sözleşmeli tarımın hukuki altyapısı nasıl oluşturulmalıdır?,1/8/1998 tarihli Resmi Gazetede yayımlanan 'Sözleşmeli Tarımsal Ürün Yetiştiriciliği ile İlgili Usul ve Esaslar Hakkındaki Tebliğ' de gerekli değişiklikler yapılarak oluşturulmalıdır.
Türkiye'de tarım danışmanlığı desteği hangi uygulamalarla ilişkilidir?,Kontrollü örtü altı tarımı ve iyi tarım uygulamaları yönetmeliği ile ilişkilidir.
Tarımsal ürünlerde taban fiyatlar ve Türkiye'de taban fiyat politikası üzerine hangi kaynak yayın yapılmıştır?,"Çivi, H., 1977. Tarımsal Ürünlerde Taban Fiyatlar ve Türkiye’de Taban Fiyat Politikası, Atatürk Üniv. İşletme Fak. Yayınları No: 59. Erzurum."
Birinci Beş Yıllık Kalkınma Planı hangi yılları kapsar?,1963-1967
Yedinci Beş Yıllık Kalkınma Planı hangi tarihte Resmi Gazete'de yayımlanmıştır?,25 Temmuz 1995
Tarım Reformu üzerine hangi makale yayınlanmıştır?,"Şahinöz, A. 2000. Tarım Reformu: Made in IMF, İşletme ve Finans, Haziran 2000."
Hazine Müsteşarlığı tarafından hangi yıl tarımsal destekler raporu yayımlanmıştır?,2004
Alternatif Ürün projesi hangi kurum tarafından yayımlanmıştır?,"TKB, Tarımsal Üretim ve Geliştirme Genel Müdürlüğü, Ankara."
Çiftçi Kayıt Sistemi (ÇKS) verileri hangi yılları kapsar?,2001-2003
Türkiye'de Çiftçi Kayıt Sistemi ve Doğrudan Gelir Desteği uygulamaları hangi yıl incelenmiştir?,2004 yılında incelenmiştir.
Çiftçi Kayıt Sistemi Veri Tabanı hangi yıl oluşturulmuştur?,2005 yılında oluşturulmuştur.
2005 yılında hangi tarımsal destek miktarları belirlenmiştir?,2005 yılı Hayvancılık Destek Miktarları belirlenmiştir.
Türkiye'de tarım politikası üzerine bir çalışma hangi üniversite tarafından yayınlanmıştır?,Atatürk Üniversitesi Ziraat Fakültesi tarafından yayınlanmıştır.
F. Yavuz'un 2003 yılında değerlendirdiği raporun adı nedir?,DPT tarafından hazırlanan 'Tarımsal Destekleme Politikaları İçin Yeni Perspektif' adlı rapordur.
Türkiye tarım politikalarının Avrupa Birliği Ortak Tarım Politikasına uyumu hangi yıl ele alınmıştır?,2004 yılında ele alınmıştır.
II. Tarım Şurası'nda hangi konuda bir komisyon raporu sunulmuştur?,Tarımsal Destekler ve Girdiler konusunda bir komisyon raporu sunulmuştur.
Kırsal kalkınma kavramı son 20 yılda neden daha fazla gündeme gelmiştir?,"Birleşmiş Milletler, Dünya Bankası, Avrupa Birliği, gönüllü kuruluşlar ve hükümetlerin kırsal kalkınma olgusuna daha fazla kaynak, bilgi ve zaman ayırması nedeniyle."
Türkiye'de kırsal kalkınma neden önemli bir konu haline gelmiştir?,"Türkiye'de tarımın ulusal gelirden aldığı payın azalması, gelir dağılımındaki dengesizlikler ve kır ile kent arasındaki sosyo-ekonomik farklılıklar nedeniyle."
Türkiye'nin kırsal kalkınma stratejileri hangi süreçle uyumlu hale getirilmeye çalışılmaktadır?,Avrupa Birliği'ne katılım sürecinde müktesebatın üstlenilmesine ilişkin yükümlülükler çerçevesinde.
Kırsal alanlar Türkiye'de nasıl tanımlanmaktadır?,İl ve ilçe merkezleri dışındaki üretime kaynak oluşturan alanlar olarak kabul edilmektedir.
Türkiye nüfusunun kırsal alanlarda yaşayan oranı nedir?,%35
Kırsal alan tanımında hangi veriler kullanılmaktadır?,"Genel nüfus sayımı, hane halkı işgücü anketi, hane halkı bütçe anketleri ve genel tarım istatistikleri verileri."
Kırsal alan tanımında karşılaşılan sorun nedir?,Kırsal alanın temel niteliklerini yansıtan tek bir tanımın yapılamamış olması.
2000 yılı Türkiye Genel Nüfus Sayımı sonuçlarına göre toplam nüfus kaç milyondur?,"67,8 milyon"
2000 yılı verilerine göre Türkiye'de kırsal alanda yaşayan nüfusun oranı nedir?,%35
1927 yılında Türkiye'de kırsal nüfusun toplam nüfusa oranı nedir?,"%75,8"
1990-2000 döneminde kent nüfusunun yıllık artış hızı nedir?,"Binde 26,8"
1950'li yıllardan sonra Türkiye'de kırsal nüfusun azalmasının nedenlerinden biri nedir?,Tarımda makineleşmeye geçiş
1985 yılına kadar kırsal nüfusta ne tür bir değişim yaşanmıştır?,Oransal azalma
Türkiye'de kırsal yerleşimlerin önemli bir sorunu nedir?,Sayıca çok ve dağınık olmaları
Türkiye'de toplam kaç kilometre köy yolu bulunmaktadır?,Türkiye’de toplam 291.895 km köy yolu bulunmaktadır.
Köy yollarının yüzde kaçı asfalt kaplamalıdır?,Köy yollarının %31’i asfalt kaplamalıdır.
Kırsal yerleşimlerde en önemli sorunlardan biri nedir?,Kırsal yerleşimlerde en önemli sorunlardan biri plansız ve dağınık yerleşimdir.
Köylerin yüzde kaçında sağlıklı içme suyu bulunmaktadır?,Köylerin %90’ında sağlıklı ve yeterli içme suyu bulunmaktadır.
2002 yılı itibariyle Türkiye genelinde okur-yazar oranı nedir?,"2002 yılı itibariyle Türkiye genelinde okur-yazar oranı %87,5’tir."
Kırsal alanda kadınların okur-yazarlık oranı nedir?,Kırsal alanda kadınların okur-yazarlık oranı %73’tür.
Kırsal alanda kanalizasyon altyapısı bulunan köylerin oranı nedir?,Kırsal alanda kanalizasyon altyapısı bulunan köylerin oranı %6’dır.
Kırsal alanda kız çocuklarının eğitimden yararlanma durumu hangi faktörlere bağlıdır?,"Kırsal alanda kız çocuklarının eğitimden yararlanmaları, köy yerleşimlerinin konumuna, altyapının yeterli ya da yetersiz oluşuna, okulların nicelik ve niteliğine ve sosyo-kültürel yapılanmaya bağlıdır."
