soru,cevap
Okulların rehberlik servisleri tarafından uygulanan testlerin sonuçları hakkında hangi yetersizlikler belirtilmiştir?,Test sonuçlarının öğrenci ve velilerine yeterince açıklanmadığı ve öğrencilere uygun yüksek öğretim kurumları hakkında bilgilendirilmelerinde yetersiz kalındığı belirtilmiştir.
Öğretmenlerin alan tercihi sürecinde karşılaştıkları en önemli sorunlar nelerdir?,"Ailelerin bilinçlendirilmesi, daha erken sınıflarda yönlendirme yapılması, mesleklerin tanıtılması, görsel materyallerin artırılması, etkili yönlendirme, yeterli bilgilendirme, okul idaresi ve rehberlik servisinin iş birliği, alan değişikliğinin kolaylaştırılması, alan dışı öğretmenlerin görevlendirilmemesi, öğretmen eksikliğinin alan öğretmenleri ile tamamlanması ve not ortalamasına göre alan tercihinin kaldırılması gibi sorunlar belirtilmiştir."
"Öğretmenler, yönlendirmenin hangi yaşlarda yapılmasını önermektedir?","Öğretmenler, yönlendirmenin ortaöğretimden daha erken sınıflarda yapılmasını önermektedir."
Velilerin bilinçlendirilmesi için ne tür etkinlikler düzenlenmelidir?,"Velilere, okul aile birliği, rehberlik servisi ve idare iş birliği ile bilgilendirici seminerler hazırlanmalı ve bu seminerlere veliler ile birlikte öğrencilerin de katılımı sağlanmalıdır."
Öğrencilerin not ortalamasına göre alan tercihi yapılmaması önerisi hangi gerekçeye dayanmaktadır?,"Öğrencilerin %38'inin dokuzuncu sınıf not ortalamasının gerçek performanslarını yansıtmadığını düşünmeleri, öğretmenlerin not ortalamasına göre alan tercihinin kaldırılması yönündeki önerilerini desteklemektedir."
Öğrencilerin meslek seçiminde hangi faktörler ön planda görülmektedir?,Öğrenciler meslek seçiminde 'maddi getirisi' ve 'iş olanaklarının fazla olması' gibi faktörleri ön planda tutmaktadır.
Okullardaki rehberlik servislerinin önemi neden artmaktadır?,"Rehberlik servislerinin önemi, öğrencilerin meslek seçiminde gelecek kaygısı taşımalarını etkili bir yönlendirme ile ortadan kaldırabileceği için artmaktadır."
Araştırmada hangi tarihlerde ulusal bir çalıştay düzenlenmiştir?,14-15 Nisan 2010 tarihlerinde ulusal bir çalıştay düzenlenmiştir.
Araştırmada hangi konular tartışılmıştır?,"Araştırmada, arzulanan öğrenci profilinin mevcut öğrenci profiliyle ne derece örtüştüğü ve eğitim sistemimizin bu profili verip veremediği tartışılmıştır."
Sonuç bölümünde hangi konulara çözüm yolları aranmıştır?,"Sonuç bölümünde, arzulanan 21. yüzyıl öğrenci profiline uygun öğrenci yetiştirilebilmesi için eğitim sistemimizin değerlendirmeye alması gereken hususlara çözüm yolları aranmıştır."
Ortaöğretim Projesi'nin hedefi nedir?,"Ortaöğretim Projesi'nin hedefi, yaşam boyu öğrenmeyi destekleyecek şekilde ortaöğretimin kalitesinin, ekonomik uygunluğunun ve eşitlik düzeyinin artırılmasıdır."
Ortaöğretim Projesi kapsamında hangi tür ortaöğretim sistemlerinin yeniden yapılandırılması amaçlanmıştır?,"Genel, mesleki ve teknik ortaöğretim sistemlerinin yeniden yapılandırılması amaçlanmıştır."
Proje kapsamında hangi kurumlar arasında bir konsorsiyum oluşturulmuştur?,"Millî Eğitim Bakanlığı Avrupa Birliği ve Dış İlişkiler Genel Müdürlüğü Projeler Koordinasyon Grup Başkanlığı, PGlobal Kuresel Danışmanlık ve Eğitim Hizmetleri, Birmingham Universitesi Uluslararası Eğitim ve Araştırma Merkezi, Gazi Üniversitesi ve Eğitim Programları ve Öğretim Derneği arasında bir konsorsiyum oluşturulmuştur."
Araştırmanın birinci aşamasında hangi yöntem kullanılmıştır?,"Birinci aşamada, nitel bir araştırma deseni olan doküman analizi kullanılmıştır."
Alan araştırması için kaç okul örneklem grubu olarak belirlenmiştir?,Alan araştırması için 380 okul örneklem grubu olarak belirlenmiştir.
Araştırma raporunun birinci bölümünde hangi konular ele alınmıştır?,"Birinci bölümde problem durumu, program değerlendirme yaklaşımları, araştırma soruları, sınırlılıklar ve tanımlar üzerinde durulmuştur."
Araştırmanın üçüncü bölümünde hangi konulara yer verilmiştir?,"Üçüncü bölümde, Genel Ortaöğretim ile Mesleki ve Teknik Ortaöğretimin eski ve yeni öğretim programlarının karşılaştırmalı olarak değerlendirilmesine ilişkin bulgular ve yorumlara yer verilmiştir."
Bakanlık tarafından gerçekleştirilen projeler hangi kaynaklardan finanse edilmektedir?,"Projeler, AB, ulusal ve uluslararası kuruluşlar ve genel bütçeden olmak üzere farklı kaynaklardan finanse edilmektedir."
"Türkiye, Avrupa Ekonomik Topluluğu'na ne zaman ortaklık başvurusunda bulunmuştur?","Türkiye, 31 Temmuz 1959'da Avrupa Ekonomik Topluluğu'na ortaklık başvurusunda bulunmuştur."
Katma Protokol hangi tarihte imzalanmış ve yürürlüğe girmiştir?,"Katma Protokol, 13 Kasım 1970 tarihinde imzalanmış ve 1973 yılında yürürlüğe girmiştir."
Türkiye-AB Gümrük Birliği ne zaman yürürlüğe girmiştir?,Türkiye-AB Gümrük Birliği 01 Ocak 1996 tarihinde yürürlüğe girmiştir.
Türkiye'nin AB üyelik başvurusu ne zaman yapılmıştır?,"Türkiye, 14 Nisan 1987 tarihinde AB üyelik başvurusunda bulunmuştur."
Helsinki Zirvesi'nde Türkiye ile ilgili hangi önemli karar alınmıştır?,Helsinki Zirvesi'nde Türkiye'nin adaylığı resmen onaylanmış ve diğer aday ülkelerle eşit konumda olacağı ifade edilmiştir.
Türkiye için hazırlanan ilk Katılım Ortaklığı Belgesi ne zaman onaylanmıştır?,Türkiye için hazırlanan ilk Katılım Ortaklığı Belgesi 8 Mart 2001 tarihinde AB Konseyi tarafından onaylanmıştır.
Türkiye'nin AB ile bütünleşme hedefindeki en önemli aşama nedir?,"Gümrük Birliği, Türkiye'nin Avrupa Birliği ile bütünleşme hedefine yönelik ortaklık ilişkisinin en önemli aşamalarından biridir."
Katılım Ortaklığı Belgesi hangi yıllarda Avrupa Birliği tarafından gözden geçirilmiştir?,"2003, 2005, 2006 ve 2008 yıllarında Avrupa Birliği tarafından gözden geçirilmiştir."
Türkiye'nin AB üyelik müzakerelerine resmi olarak başlaması hangi tarihte gerçekleşmiştir?,3 Ekim 2005 tarihinde Türkiye resmi olarak AB üyelik müzakerelerine başlamıştır.
AB'nin eğitim ve öğretim politikaları hangi düzeyde belirlenmektedir?,AB'de eğitim ve öğretim politikaları temel olarak ulusal düzeyde belirlenmektedir.
"Türkiye, eğitim ve kültür alanlarında hangi AB stratejisi kapsamında adımlar atmaktadır?","Türkiye, AB 2020 Stratejisi ve Eğitim ve Öğretim 2020 çalışma programı kapsamında adımlar atmaktadır."
2004 Brüksel Zirvesi'nde Türkiye hakkında hangi önemli karar alınmıştır?,"17 Aralık 2004 tarihli Brüksel Zirvesi'nde, Türkiye'nin siyasi kriterleri yeteri ölçüde karşıladığı belirtilerek 3 Ekim 2005'te müzakerelere başlanması kararı alınmıştır."
Avrupa Birliği kaç üyeden oluşmaktadır?,28 üyeden oluşmaktadır.
Türkiye hangi yıl AB adaylık statüsü kazanmıştır?,1999 yılı Helsinki Zirvesinde adaylık statüsü kazanmıştır.
1964-1995 döneminde Türkiye ne kadar mali yardım almıştır?,Toplam 1 milyar avro kullanılmıştır.
1996-1999 döneminde Türkiye'ye sağlanan toplam yardım miktarı nedir?,"Toplam yardım 755,3 milyon avro tutarındadır."
MEDA-I Programı kapsamında Türkiye'ye ne kadar avro taahhüt edilmiştir?,376 milyon avro taahhüt edilmiştir.
1997-1999 dönemi için Türkiye'ye ne kadar kredi sağlanmıştır?,205 milyon avro tutarında kredi sağlanmıştır.
"Türkiye, 2000-2006 döneminde kaç proje için toplam ne kadar fon kullanmıştır?","Türkiye, toplam 164 proje için yaklaşık 1,3 milyar avroluk fon kullanmıştır."
Fonlar hangi üç ana alan için kullanılmıştır?,"Kurumsal yapılanma (%30), AB müktesebatına uyum (%35) ve ekonomik ve sosyal uyumun (%35) temini için kullanılmıştır."
2000-2006 döneminde Türkiye için ayrılan MEDA-II Programı miktarı nedir?,Türkiye için ayrılan miktar 890 milyon avrodur.
"Türkiye, AB ile katılım müzakerelerine ne zaman başlamıştır?",Ekim 2005 tarihinde başlamıştır.
IPA nedir ve hangi amaçla oluşturulmuştur?,"IPA, Katılım Öncesi Yardım Aracı olarak aday ve potansiyel aday ülkelere yapılan mali yardımları birleştiren bir mekanizmadır. Temel amacı, aday ülkenin AB’ye üye olma yolundaki ihtiyaç ve önceliklerine hizmet eden projelerin desteklenmesidir."
IPA bileşenleri nelerdir?,"IPA bileşenleri, Geçiş Dönemi Desteği ve Kurumsal Yapılanma, Sınır Ötesi İşbirliği, Bölgesel Kalkınma, İnsan Kaynaklarının Geliştirilmesi ve Kırsal Kalkınma (IPARD) olarak belirlenmiştir."
2007-2013 yılları arasında IPA kapsamında Türkiye'ye ne kadar fon ayrılmıştır?,"2007-2013 yılları arasında IPA kapsamında Türkiye'ye yaklaşık 4,8 milyar avro fon ayrılmıştır."
IPA hangi ülkeleri kapsamaktadır?,"IPA, aday statüsündeki ülkeler (İzlanda, Makedonya, Karadağ, Sırbistan ve Türkiye) ve potansiyel aday statüsündeki ülkeleri (Arnavutluk, Bosna-Hersek ve Kosova) kapsamaktadır."
IPA'nın sağladığı mali destek hangi alanları kapsamaktadır?,"IPA, geçiş dönemi ve kurumsal yapılanma desteği yanı sıra çevre, ulaştırma, bölgesel rekabet, insan kaynakları kalkınması ve kırsal kalkınma gibi alanlarda mali destek sağlamaktadır."
IPA'nın temel amacı nedir?,"IPA'nın temel amacı, aday ülkeleri üyelik sonrası yapısal ve uyum fonlarının programlaması, yönetimi ve uygulamasına hazırlamak ve bu sayede AB Mali Yardımlarının daha yüksek derecede tutarlılığı ve koordinasyonu sağlamaktır."
Hangi ülke 2011 yılında yardımlardan faydalanmaya başlamıştır?,"İzlanda, 2011 yılında yardımlardan faydalanmaya başlamıştır."
Hangi ülke en yüksek toplam mali yardımı almıştır?,"Türkiye, 4795 milyon Avro ile en yüksek toplam mali yardımı almıştır."
Geçiş Dönemi Desteği ve Kurumsal Yapılanma bileşeninin yönetiminden hangi bakanlık sorumludur?,Geçiş Dönemi Desteği ve Kurumsal Yapılanma bileşeninin yönetiminden Avrupa Birliği Bakanlığı sorumludur.
Karadağ'ın kişi başına aldığı mali yardım miktarı nedir?,Karadağ'ın kişi başına aldığı mali yardım miktarı 378.2 Avro'dur.
2014-2020 döneminde hangi bakanlık program otoriteliği altında projeler ele alınacaktır?,Çalışma ve Sosyal Güvenlik Bakanlığı program otoriteliği altında projeler ele alınacaktır.
"İstihdam, Eğitim ve Sosyal Politikalar Sektörel Operasyonel Programı taslağı nerede yayımlanmıştır?",ÇSGB internet sitesinde yayımlanmıştır.
Eğitime ilişkin belirlenen üç temel faaliyet alanı nelerdir?,"Eğitim-öğretimin niteliğinin artırılması, herkesin eğitime erişimini sağlayarak beceri düzeyinin ve eğitim kazanımlarının artırılması ve ulusal yeterlilikler sisteminin güçlendirilmesi ve hayat boyu öğrenmenin teşvik edilmesidir."
AB fonlu projelerin hangi aşamalarında AB Delegasyonu'nun ön onayı gerekmektedir?,"İhale dosyalarının hazırlanmasından ihale çıkılmasına, değerlendirme komitesi üyelerinin belirlenmesinden sözleşmelerin imzalanmasına kadar olan aşamalarda AB Delegasyonu'nun ön onayı gerekmektedir."
Ortaöğretim Projesi (OÖP) hangi anlaşma kapsamında başlamıştır?,Hükümetimiz ile Dünya Bankası (IBRD) arasında 22 Şubat 2006 tarihinde imzalanan ikraz anlaşması kapsamında başlamıştır.
Projenin toplam bütçesi ne kadardır?,80 Milyon Avro
Projenin kaynağı nedir?,Dünya Bankası - Kredi
Projenin başlama ve bitiş tarihleri nelerdir?,"Başlama Tarihi: 22 Şubat 2006, Bitiş Tarihi: 30 Nisan 2012"
Projenin genel hedefi nedir?,"Yaşam boyu öğrenmeyi destekleyecek şekilde ortaöğretimin kalitesinin, ekonomik uygunluğunun ve eşitlik düzeyinin artırılması."
Projenin bileşenlerinden biri olan Ortaöğretim Reformu nedir?,"Öğrencilerin yaşantı ve ilgilerine duyarlı, değişim ortamında sorun çözmeyi ve sorunlarla başa çıkmayı önceleyen ortaöğretimin yeniden yapılandırılması kapsamında, yapılandırmacı yaklaşımla hazırlanan ve öğrenciyi merkeze alan 66 dersin öğretim programı geliştirilerek uygulamaya konulmuştur."
Bilişim teknolojileri ekipmanı alımları hangi illerdeki okullara yapılmıştır?,Kalkınmada öncelikli olan 50 ilimizdeki 1629 ortaöğretim okuluna yapılmıştır.
Ulusal Mesleki Bilgi Sistemi (MBS) hangi amaçlarla kurulmuştur?,"Her yaştan bireylerin mesleki rehberlik çalışmalarına erişimini kolaylaştırmak, bu çalışmaları yaygınlaştırmak, MEB, İŞKUR ve diğer kurumlar kapsamında verilen mesleki rehberlik çalışmalarına destek ve eşgüdüm sağlamak ve 13 yaş ve üstü bireylere rehberlik etmek amacıyla kurulmuştur."
Ortaöğretim Projesi kapsamında hangi tür araştırmalar gerçekleştirilmiştir?,"Ortaöğretim programları/modüllerinin değerlendirilmesi, Mesleki Eğitim Girişimleri, 21. yy’da Öğrenci Profili, Ortaöğretimin Süresi Bakımından Değerlendirilmesi, Sektörün Gıda Teknolojisi Alanında Mesleki/Teknik Eğitim Okulları/Kız Meslek Liselerinden Beklentileri gibi araştırmalar gerçekleştirilmiştir."
MEB'in 21. Yüzyıl Öğrenci Profili ile ilgili hangi çalışmalar yapılmıştır?,Bakanlık eğitim politikalarının belirlenmesine ve geliştirilmesine katkı sağlamayı amaçlayan araştırmalar gerçekleştirilmiştir.
Mesleki rehberlik çalışmalarına kimler erişebilir?,13 yaş ve üstü tüm bireyler erişebilir.
"Bakanlık, hangi amaçla web tabanlı performans yönetim sistemi oluşturmuştur?","Öğrencilerin, öğretmenlerin, her düzeydeki yöneticilerin yeterliliklerini ve eğitim kurumlarının standartlarını belirlemek ve performansa dayalı ölçme ve değerlendirmeye geçmek amacıyla oluşturulmuştur."
Mesleki Eğitim Girişimleri ile ne tür bir süreç hızlandırılmak istenmiştir?,Mesleki Eğitim Girişimleri ile ortaöğretim reform sürecinin yerelleşme süreci hızlandırılmak istenmiştir.
Okul Gelişim Programı kapsamında kaç ilçedeki okullara hibe kaynağı sağlanmıştır?,Okul Gelişim Programı kapsamında 60 ilçedeki 3671 okula hibe kaynağı sağlanmıştır.
Mesleki eğitim programlarının kalitesini artırmak için kaç proje teklifi desteklenmiştir?,Mesleki eğitim programlarının kalitesini artırmak için 46 proje teklifi desteklenmiştir.
Projenin değerlendirilmesi amacıyla hangi faaliyetlere yönelik araştırma yapılması planlanmıştır?,"Müfredat reformu, Mesleki Eğitim Girişimleri ve Okul Gelişim Programı faaliyetlerine yönelik üç araştırma yapılması planlanmıştır."
Müfredat Reformu Etki Araştırması ve Mesleki Eğitim Girişimleri Yararlanıcı Araştırması projesi kapsamında bugüne kadar hangi faaliyetler gerçekleştirilmiştir?,"18 çalıştayın yanı sıra; geliştirilen programların tanıtımı, personel kapasitesinin artırılması, yabancı dil öğretmenleri için öğretim yöntem ve teknikleri vb. konularda eğitim faaliyetleri gerçekleştirilmiştir."
Eğitimde Toplumsal Cinsiyet Eşitliğinin Desteklenmesi Projesi'nin uygulama süreci ne zaman başlamıştır?,19/09/2014 tarihinde başlamıştır.
Eğitimde Toplumsal Cinsiyet Eşitliğinin Desteklenmesi Projesi'nin amacı nedir?,"Cinsiyetler arasındaki biyolojik farklılıklara yüklenmiş kültürel ayrıntılar ve anlamların toplumda yol açtığı cinsiyet rolleri arasındaki olumsuz etkileri ortadan kaldırmayı, cinsiyet eşitliğine katkı sağlamayı, okullarda kız ve erkek çocuklar için cinsiyet eşitliğini geliştirmeyi ve cinsiyete duyarlı yaklaşımı tüm eğitim sistemine yerleştirmeyi amaçlamaktadır."
Eğitimde Toplumsal Cinsiyet Eşitliğinin Desteklenmesi Projesi'nin hedef grubu kimlerdir?,"Okul öncesi, ilköğretim ve ortaöğretim seviyesinde bulunan öğrenci, veli, öğretmen ve eğitim öğretim süresinde görev alan tüm personel projenin hedef grubudur."
Eğitimde Toplumsal Cinsiyet Eşitliğinin Desteklenmesi Projesi hangi illerde uygulanacaktır?,"Erzurum, Batman, Samsun, İzmir, Malatya, Mardin, Şanlıurfa, Karaman, Trabzon ve Sivas illerinde uygulanacaktır."
Cinsiyet Eşitliği Güvence Aracı hangi amaçla geliştirildi?,"Cinsiyet Eşitliği Güvence Aracı, okullardaki tüm personel için rehber ve değerlendirme aracı olarak kullanılacak şekilde geliştirilmiştir."
Proje kapsamında hangi eğitim materyalleri gözden geçirilecek?,"İlkokuldan lise son sınıfa kadar tüm öğretim programları, ders kitapları ve eğitim materyalleri gözden geçirilecektir."
Toplumsal cinsiyet eşitliği konusunda hangi tür etkinlikler düzenlenecek?,Toplumsal cinsiyet eşitliği konusunda toplumsal bilincin artırılmasına yönelik medya etkinlikleri ve bölgesel kampanyalar düzenlenecektir.
Geleceğin Kan Bağışçılarının Kazanımı Projesi ne zaman başladı?,Geleceğin Kan Bağışçılarının Kazanımı Projesi 26/02/2014 tarihinde başlamıştır.
Proje kapsamında hangi kurumun kapasitesi geliştirildi?,"Proje kapsamında MEB’in (Milli Eğitim Bakanlığı) kapasitesi, eşitlikçi ve toplumsal cinsiyete duyarlı bir yaklaşımın yaygınlaştırılması konusunda geliştirilmiştir."
Geleceğin Kan Bağışçılarının Kazanımı Projesi'nin amacı nedir?,"Güvenli kanın temin edilmesindeki sorunları gidererek toplum sağlığının iyileştirilmesine katkıda bulunmak ve gönüllü, kazanç beklemeyen kan bağışçılarından güvenli kanın teminini sağlamaktır."
Projenin hedef grubu kimlerden oluşmaktadır?,"İlköğretim ve ortaöğretim kurumlarında okuyan öğrenciler, aileleri, okul yöneticileri, öğretmenleri ile Millî Eğitim Bakanlığı, Sağlık Bakanlığı ve Türk Kızılay’ında çalışan ilgili personelden oluşmaktadır."
Proje hangi kurumlarla iş birliği içinde yürütülmektedir?,"Millî Eğitim Bakanlığı, Sağlık Bakanlığı ve Türk Kızılayı ile iş birliği içinde yürütülmektedir."
Projenin toplam bütçesi nedir ve kaynağı nereden gelmektedir?,"Toplam bütçe 2,5 Milyon Avro olup, %90'ı Avrupa Birliği Hibesi (2.250.000 Avro) ve %10'u Ulusal Katkı (250.000 Avro) olarak sağlanmaktadır."
Proje kapsamında düzenlenen ana faaliyetler nelerdir?,"İlk ve ortaöğretim seviyelerindeki mevcut müfredatın yenilenmesi, kan bağışının önemi kapsamında materyaller geliştirilmesi, SB, MEB ve Türk Kızılayı’nın insan kaynakları kapasitelerinin arttırılması, gönüllü kan bağışçısı kazanımı konusunda bilincin arttırılması, 500 pilot okulda 'Kan Bağışçısı Eğitimi ve Kazanımı' ve ülke çapında 'Basın ve Halkla İlişkiler' kampanyalarının düzenlenmesidir."
Hükûmetimiz ve UNICEF Ülke Programı Eylem Planı hangi yılları kapsıyor?,2011-2015 yıllarını kapsıyor.
Araştırmanın amacı nedir?,"Araştırmanın amacı, ortaöğretimde sınıf tekrarı ve okul terk sebeplerini tespit ederek bu engellerin ortadan kaldırılması ve sorunların çözümüne yönelik politika önerileri geliştirmektir."
Araştırmanın hedef grubu kimlerden oluşmaktadır?,"Araştırmanın hedef grubu, ortaöğretimde sınıf tekrarı yapan ve okulu terk eden öğrenciler, 14-18 yaş grubunda olup örgün eğitim dışında kalan çocuklar, bu çocukların aileleri, öğretmenleri ve okul yöneticileridir."
Araştırmanın süresi ne kadardır?,Araştırmanın süresi 24 aydır.
Araştırma hangi illerde yapılmıştır?,"Araştırma İstanbul, Balıkesir, Afyon, Sakarya, Konya, Kahramanmaraş, Aksaray, Sinop, Gümüşhane, Ağrı, Kars, Muş, Van, Şanlıurfa ve Şırnak illerinde yapılmıştır."
Araştırmanın ana faaliyetleri nelerdir?,"Araştırmanın ana faaliyetleri masa başı çalışması, saha çalışması, MEB ve UNICEF yorumlarının alınması, politika seçeneklerinin geliştirilmesi ve nihai raporun sunulmasıdır."
Araştırmanın beklenen sonuçlarından biri nedir?,"2015 sonuna kadar 14-18 yaş grubundan tüm kız ve erkekler için istihdam olunabilirlik, yaşam becerileri ve katılım fırsatları anlamında kalıcı iyileşmeler sağlanması beklenmektedir."
Saha çalışmaları için belirlenen örneklem grubu kaç kişiden oluşmaktadır?,"Saha çalışmaları için okulu terk eden öğrencilerin örneklem grubu 3600 kişi, sınıf tekrarı yapan öğrencilerin örneklem grubu ise 3696 kişi olarak belirlenmiştir."
Araştırma kapsamında hangi kurumların yorumları alınmıştır?,Araştırma kapsamında MEB ve UNICEF’in yorumları alınmıştır.
Saha araştırması sonucu elde edilen verilerle ne yapılmıştır?,Saha araştırması sonucu elde edilen veriler analiz edilerek ön rapor oluşturulmuş ve iki çalıştay gerçekleştirilmiştir.
Ortaöğretime Uyum Programı hangi iş birliği kapsamında hazırlanmıştır?,"Ortaöğretime Uyum Programı, Hükûmetimiz ve Birleşmiş Milletler Çocuklara Yardım Fonu (UNICEF) iş birliğinde hazırlanan Ülke Programı Eylem Planı (2011-2015) kapsamında hazırlanmıştır."
Ortaöğretime Uyum Programının amacı nedir?,"Ortaöğretime Uyum Programının amacı, 9. sınıf öğrencilerine okulun fiziki, sosyal ve idari birimlerini, kurallarını ve işleyişini tanıtarak, öğrencilerin yeni girdikleri okul ortamına kısa sürede alışmalarını sağlamaktır."
Ortaöğretime Uyum Programının hedef grubu kimlerden oluşmaktadır?,"Ortaöğretime Uyum Programının hedef grubu, ortaöğretim kurumlarındaki 9. sınıf öğrencileri, veliler, rehber öğretmenler ve 9. sınıf derslerine giren öğretmenlerden oluşmaktadır."
Ortaöğretime Uyum Programının gerekçesi nedir?,"Ortaöğretime Uyum Programının gerekçesi, yapılan araştırmalara göre okulu terk etme ve sınıf tekrarı yapma riskinin en yüksek olduğu sınıfın 9. sınıf olmasıdır."
Araştırma kapsamında kaç öğrenciye ölçme aracı uygulanmıştır?,Araştırma kapsamında 2599 sınıf tekrarı yapan öğrenci ve 2574 okulu terk eden öğrenciye ölçme aracı uygulanmıştır.
Okulu terk etme ve sınıf tekrarı yapma nedenlerinden biri nedir?,Okula uyum sağlayamama.
Öğrencilerin okula severek gelmeleri için ne tür bir ortam yaratılması önemlidir?,Olumlu ve güven verici bir ortam.
Ortaöğretime Uyum Programı kimlere uygulanması amaçlanmıştır?,Ortaöğretim kurumlarında eğitim ve öğretime başlayan 9. sınıf öğrencilerine.
Uyum hizmeti neyi amaçlamaktadır?,"Öğrencilere okulu, kurallarını, işleyişini tanıtmak ve yeni girdikleri ortama kısa sürede alışmalarını kolaylaştırmak."
Uyum Programının genel hedeflerinden biri nedir?,"Okulun fiziki, sosyal ve idari birimlerini tanıtmak."
9. sınıfa geçiş neden önemlidir?,"9. sınıfa geçiş, öğrencilerin liseyi bitirip bitirmeyeceklerini belirleyebilecek deneyimler sunduğu için önemlidir."
9. sınıfta düşük not almanın sonuçları nelerdir?,9. sınıfta düşük not alan öğrencilerin okulu terk etme olasılığı yüksektir.
9. sınıf öğrencilerinin en büyük korkuları nelerdir?,"Okulda aradıkları ortamı bulamamak ve dışlanmak, 9. sınıf öğrencilerinin en büyük korkularındandır."
"Lisenin büyüklüğü, 9. sınıf öğrencilerini nasıl etkiler?","Lise ne kadar büyükse, geçiş döneminin 9. sınıflar üzerindeki olumsuz etkisi o kadar büyük olur."
9. sınıf öğrencilerinin akademik ve sosyal kabul hissetmeleri için ne gereklidir?,9. sınıf öğrencilerinin akademik ve sosyal olarak kabul edilmiş hissetmeleri için yaşamlarında onları destekleyen en az bir yetişkine sahip olmaları gerekir.
Uyum Programı Geliştirme Çalıştayı ne zaman düzenlendi?,19–23 Ağustos 2013 tarihleri arasında düzenlendi.
Uyum Programı Geliştirme Çalıştayı'na kaç pilot okul davet edildi?,Çalıştaya 10 ilden 12 lise pilot okul olarak davet edildi.
Uyum Programı Öğretmen Kılavuzu ne zaman oluşturuldu?,Çalıştay sırasında Uyum Programı Öğretmen Kılavuzu oluşturuldu.
Ortaöğretime Uyum Eğitimi Çerçeve Programı ne zaman uygulandı?,11-13 Eylül 2013 tarihleri arasında uygulandı.
Değerlendirme Toplantısı nerede yapıldı?,Antalya’da yapıldı.
Ortaöğretime Uyum Programı Eğitimi hangi tarihler arasında verilmiştir?,12-23 Ağustos 2014 tarihleri arasında verilmiştir.
"Ortaöğretime Uyum Programı kapsamında eğitimi alan öğretmenler, eğitimi ne zaman öğrencilere ve velilere aktarmışlardır?",10-11-12 Eylül 2014 tarihlerinde aktarmışlardır.
Sosyal Etkinlikler Portfolyosu projesinin amacı nedir?,"Öğrencileri bir bütün olarak eğitmek, sorumluluk duygularını geliştirmek ve sosyal-kültürel, sanatsal ve sportif alanlardaki kabiliyetlerini teşvik etmektir."
Sosyal Etkinlikler Portfolyosu projesi hangi illerde uygulanacaktır?,"Aksaray, Aydın, Bolu, Düzce, Kayseri, Rize, Sivas, Trabzon ve Yozgat illerinde uygulanacaktır."
Ortaöğretime Uyum Programı hangi kuruluşlarla iş birliği içinde hazırlanmıştır?,Hükûmetimiz ve Birleşmiş Milletler Çocuklara Yardım Fonu (UNICEF) iş birliği içinde hazırlanmıştır.
Portfolyo taslağı kimlerin katılımıyla hazırlanmıştır?,"Portfolyo taslağı, Avrupa ülkelerinden uzmanların ve Bakanlığın ilgili birimlerinden yetkililerin katılımıyla hazırlanmıştır."
Sosyal Etkinlikler Portfolyosunun verimli kullanımı için ne tür bir etkinlik düzenlenmiştir?,Sosyal Etkinlikler Portfolyosunun verimli kullanımı konularında öğretmen eğitimleri düzenlenmiştir.
