soru,cevap
Millî Eğitim Bakanlığı Okul Kütüphaneleri hangi yönetmelik ile düzenlenir?,"Millî Eğitim Bakanlığı Okul Kütüphaneleri, Millî Eğitim Bakanlığı Okul Kütüphaneleri Yönetmeliği ile düzenlenir."
Bakanlığımızın 652 sayılı Kanun Hükmünde Kararname çerçevesinde hangi değişiklikler yapılmıştır?,"Genel Müdürlüğümüz görev alanına giren birçok mevzuatta değişiklik ve düzenleme yapılmıştır. 6287 sayılı Kanun kapsamında eğitim sistemimizin 4+4+4 şeklinde yeniden yapılandırılması, programların, ders çizelgelerinin ve okul türlerinin yeniden belirlenmesi nedeniyle yoğun bir mevzuat düzenleme süreci yaşanmıştır."
7 Eylül 2013 tarihli ve 28758 sayılı Resmî Gazete'de yayınlanan yönetmelikle hangi yönetmelikler yürürlükten kaldırılmıştır?,"8/11/1989 tarihli ve 20336 sayılı Resmî Gazete’de yayımlanan Ortaokul ve Ortaöğretim Kurumlarındaki Öğrencilerin Ders Dışı Eğitim ve Öğretim Faaliyetleri Hakkında Yönetmelik, 6/9/1998 tarihli ve 23455 sayılı Resmî Gazete’de yayımlanan Millî Eğitim Bakanlığı Anadolu Öğretmen Liseleri Yönetmeliği, 10/1/1999 tarihli ve 23579 sayılı Resmî Gazete’de yayımlanan Millî Eğitim Bakanlığı Fen Liseleri Yönetmeliği, 5/11/1999 tarihli ve 23867 sayılı Resmî Gazete’de yayımlanan Millî Eğitim Bakanlığı Anadolu Liseleri Yönetmeliği, 3/7/2002 tarihli ve 24804 sayılı Resmî Gazete’de yayımlanan Mesleki ve Teknik Eğitim Yönetmeliği, 17/11/2003 tarihli ve 25292 sayılı Resmî Gazete’de yayımlanan Millî Eğitim Bakanlığı Sosyal Bilimler Liseleri Yönetmeliği, 8/12/2004 tarihli ve 25664 sayılı Resmî Gazete’de yayımlanan Millî Eğitim Bakanlığı Ortaöğretim Kurumları Sınıf Geçme ve Sınav Yönetmeliği, 19/1/2007 tarihli ve 26408 sayılı Resmî Gazete’de yayımlanan Millî Eğitim Bakanlığı Ortaöğretim Kurumları Ödül ve Disiplin Yönetmeliği, 16/6/2009 tarihli ve 27260 sayılı Resmî Gazete’de yayımlanan Millî Eğitim Bakanlığı Güzel Sanatlar ve Spor Liseleri Yönetmeliği."
Genel Müdürlüğümüz görev alanında hangi çalışmalar yapılmıştır?,"Mevzuatın sadeleştirilmesi, basitleştirilmesi ve güncellenmesi çalışmaları kapsamında Genel Müdürlüğümüz görev alanında yer alan birçok mevzuatta değişiklik ve düzenleme yapılmıştır. Ayrıca güncelliğini yitiren ve uygulama alanı kalmayan koordinesi Genel Müdürlüğümüzde bulunan birçok yönetmelik, yönerge ve genelge yürürlükten kaldırılmıştır."
6287 sayılı Kanun kapsamında eğitim sisteminde ne tür değişiklikler yapılmıştır?,"Eğitim sistemimiz 4+4+4 şeklinde yeniden yapılandırılmış, programlar, ders çizelgeleri ve okul türleri yeniden belirlenmiştir."
7 Eylül 2013 tarihli yönetmelik hangi tarihteki Resmî Gazete'de yayımlanmıştır?,7 Eylül 2013 tarihli ve 28758 sayılı Resmî Gazete'de yayımlanmıştır.
Hangi tarihte Millî Eğitim Bakanlığı Ortaöğretim Kurumları Yönetmeliği yayımlanmıştır?,31/7/2009 tarihinde yayımlanmıştır.
Millî Eğitim Bakanlığı İmam-Hatip Liseleri Yönetmeliği hangi tarihte Resmî Gazete’de yayımlanmıştır?,31/7/2009 tarihinde Resmî Gazete’de yayımlanmıştır.
Millî Eğitim Bakanlığı Ortaöğretim Kurumları Öğrenci Nakil ve Geçiş Yönergesi ne olmuştur?,Yürürlükten kaldırılmıştır.
Anadolu Öğretmen Liseleri Öğrencilerinin Uygulamaları İzleme Etkinlikleri Yönergesi hakkında ne yapılmıştır?,Yürürlükten kaldırılmıştır.
Sağlık Meslek Lisesi Öğrencilerinin Mesleki Eğitim Uygulamalarına İlişkin Yönerge ile ilgili ne karar alınmıştır?,Yürürlükten kaldırılmıştır.
Eğitim nedir ve eğitim-öğretim faaliyetlerinin nasıl yapılması gerekmektedir?,"Eğitim, bireyin davranışlarında istendik yönde değişiklik oluşturma sürecidir. Eğitim-öğretim faaliyetlerinin planlı ve programlı yapılması gerekmektedir."
Öğretim programları neyi kapsamaktadır?,"Öğretim programları, bireylere kazandırılması hedeflenen davranışları, bu davranışlar kazandırılmaya çalışılırken hangi içerik ve eğitim durumlarından yararlanılacağını kapsamaktadır."
Haftalık ders çizelgeleri neyi belirlemektedir?,"Haftalık ders çizelgeleri, hangi dersin haftada ne kadar süreyle okutulacağını belirleyen çizelgelerdir."
Öğretim materyalleri nasıl tanımlanabilir?,"Öğretim materyalleri, öğretim programının içerikle bütünleştirilerek öğrencilere sunulan bir araçtır ve öğretim programları ruh ise öğretim materyalleri beden olarak tasvir edilebilir."
Türkiye’de program geliştirme çalışmaları ne zaman sistemli bir biçime dönüşmeye başlamıştır?,"Türkiye’de program geliştirme çalışmaları, 1950’li yıllarda sistemli bir biçime dönüşmeye başlamıştır."
Okul program geliştirme çalışmaları Türkiye'de kaç ana dönemde incelenebilir?,Türkiye'deki program geliştirme çalışmaları başlıca dört ana dönemde incelenebilir.
1924 İlk Mektep Müfredat Programı hangi ihtiyaçlar göz önünde bulundurularak hazırlanmıştır?,"1924 programı, yeni kurulan Türkiye Cumhuriyeti’nin eğitim ve öğretim anlayışı, ihtiyacı ve şartları düşünülerek hazırlanmıştır."
1926 İlk Mektep Müfredat Programı'nın önemi nedir?,"1926 programı, bugünkü programların dayandığı altı temel esası kapsaması bakımından önemlidir."
1928-1960 yılları arasında öğretim materyalleriyle ilgili ne tür sorunlar yaşanmıştır?,"Matbaa sayısının yetersiz olması nedeniyle materyaller yeterince basılamamış ve kaynaklar sadece öğretmenlerde bulunmuştur, bu da öğrencileri ezbere yönlendirmiştir."
"John Dewey, Türkiye'deki program geliştirme çalışmalarına nasıl bir katkıda bulunmuştur?","John Dewey, Türk halkının ihtiyaçlarına uygun olacak şekilde programların geliştirilmesini önermiştir."
Program geliştirme çalışmalarının tarihçesi nasıl başlamıştır?,"1950’li yıllara kadar program geliştirme çalışmaları daha çok ders ve konu listesi hazırlama şeklinde ele alınmıştır. 1949 yılında John Rufi, Türkiye’deki mevcut programların amaçlarına ulaşamadığını belirtmiş ve Türkiye’nin kendi uzmanlarınca program geliştirme çalışmaları yapması gerektiğini ifade etmiştir."
Ortaöğretimin tanım ve fonksiyonu nasıl değişmiştir?,"Ortaöğretimin tanım ve fonksiyonu, program geliştirme çalışmalarının sonucunda, öğrencilerin yükseköğretim kurumlarına hazırlanmasının yanında genel eğitim veren ve esas fonksiyonu ortaöğretimden sonra hayata atılacak gençlere hem genel kültür, hem de ilgi, istek ve yetenekleri doğrultusunda gerekli meslek öncesi bilgi ve becerileri kazandıran bir kurum olarak değişmiştir."
1953-1954 yıllarında başlayan kapsamlı program geliştirme çalışmaları nelerdir?,1953’te ülkemizin çeşitli bölgelerinde çok amaçlı programları içeren okul sisteminin uygulamaya konulmasıyla kapsamlı program geliştirme çalışmaları başlamıştır. Ancak bu girişim düşünüldüğü kadar etkili olamamıştır.
Deneme okullarında yürütülen programın sonuçları nelerdir?,"Deneme okullarında yürütülen programın deneysel yöntemle karşılaştırılması sonucunda, deneme programında eğitim alan bireyler yönünde hem başarı hem de kabiliyet olarak daha üstün oldukları sonucuna ulaşılmıştır. Ancak bu program ülke geneline yaygınlaştırılmamıştır."
Tevhid-i Tedrisat Kanunu ile başlayan program geliştirme çalışmalarının amacı nedir?,"1924 yılında Tevhid-i Tedrisat Kanununun kabulüyle başlayan program geliştirme çalışmaları, dönemin ihtiyacı olan yeni nesillere Cumhuriyet rejimini benimsetmeyi amaç edinmiştir."
Modernleşme Dönemi'nde (1960-1984) Türkiye'de öğretim programlarının geliştirilmesi süreci hangi aşamaları içermektedir?,"Talim ve Terbiye Kurulu Başkanlığı tarafından amaçların belirlenmesi, konuların listesi Tebliğler Dergisinde yayınlanması, amaç ve konuların resmiyet kazanarak yürürlüğe girmesi, uygun ders kitaplarının hazırlanması ve seçilen kitabın ders kitabı olarak belirlenmesi aşamalarını içermektedir."
1960'lı yıllarda Türkiye'de fen bilimleri öğretiminde ne tür iyileştirme çalışmaları başlatılmıştır?,Millî Eğitim Bakanlığı ve Ford Vakfı arasında yapılan anlaşma ile Fen Lisesi projesi başlatılmış ve Ankara Fen Lisesi kurulmuştur.
Ankara Fen Lisesi'nde hangi tür programlar uygulanmıştır?,ABD'de uygulanan modern programlar tercüme edilerek okutulmuştur.
Fen Öğretimini Geliştirme Bilimsel Komisyonu ne zaman kurulmuştur ve amacı nedir?,"1967 yılının başlarında kurulmuş olup, fen programlarının modernleştirilmesi çalışmalarını yürütmek amacıyla oluşturulmuştur."
BAYG-E-7 projesi hangi kurum ve vakfın iş birliği ile yürütülmüştür?,TÜBİTAK iş birliği ve Ford Vakfı'nın malî desteği ile yürütülmüştür.
Fen Öğretimini Geliştirme Bilimsel Komisyonu ve TÜBİTAK işbirliğiyle hangi karara varılmıştır?,Türkiye genelinde fen öğretimi programlarının yaygınlaştırılması kararı alınmıştır.
1983 yılında yayınlanan Fen Programları Durum Değerlendirmesi Komisyon Raporunda hangi eksiklikten bahsedilmektedir?,Programın uygulanması için gerekli alt yapının tam olarak oluşturulamadığı belirtilmiştir.
1980 yılında hangi iki kurum arasındaki anlaşma yenilenmemiştir?,Millî Eğitim Bakanlığı ve TÜBİTAK arasındaki anlaşma yenilenmemiştir.
1984 yılında modern fen programlarıyla ilgili ne gibi bir değişiklik olmuştur?,Modern fen programları tamamen kaldırılmıştır.
1990 yılında hangi alanlarda program geliştirme ihtisas komisyonları oluşturulmuştur?,"Türkçe, Matematik, Güzel Sanatlar, Sanat Tarihi, Psikoloji, Fen Bilgisi, Tarih, Felsefe Grubu ve Sosyal Bilgiler alanlarında komisyonlar oluşturulmuştur."
Türk Millî Eğitim Sistemi için 1983 yılında önerilen program modeli nedir?,1983 yılında kabul edilen program modeline göre hazırlık yapılması önerilmiştir.
Ders geçme ve kredi sistemi hangi tarihte uygulamaya konulmuştur?,Ders geçme ve kredi sistemi 02.09.1991 tarihinde uygulamaya konulmuştur.
Sınıf Geçme-Alan Sistemi hangi eğitim öğretim yılından itibaren uygulanmaya başlanmıştır?,Sınıf Geçme-Alan Sistemi 1995-1996 eğitim öğretim yılından itibaren uygulanmaya başlanmıştır.
1997 yılında geliştirilen öğretim programlarının amacı nedir?,"Amaç, bilim toplumunu oluşturacak bireylerin karşılaştıkları problemlere bilimsel yaklaşımla çözüm bulma alışkanlığını kazandırmaktır."
Öğretim programlarının hazırlanma sürecinde hangi kaynaklardan faydalanılmıştır?,"İhtiyaç analizi raporları, bilim ve teknolojideki gelişmeler, uzman görüşleri, alandaki literatür taramaları, Türkiye ve dünyadaki mevcut program ve kitaplardan faydalanılmıştır."
2005-2006 eğitim ve öğretim yılından itibaren ne tür değişiklikler yapılmıştır?,"Bütün ortaöğretim kurumlarında haftalık ders çizelgelerinde yer alan ortak kültür, alan ve seçmeli derslerin öğretim programları yeni yaklaşımlarla yeniden hazırlanarak uygulamaya konmuştur."
Öğretim programları geliştirilirken hangi kaynaklar gözden geçirilmiştir?,"Anayasa, eğitim ve öğretimle ilgili kanunlar, kalkınma planları, şûra kararları, akademik tezler, araştırmalar vb. kaynaklar gözden geçirilmiştir."
Yeni programlar hangi standartlara uygun olarak hazırlanmıştır?,AB standartlarına uygun olarak hazırlanmıştır.
Yeni öğretim programlarında hangi yaklaşımlar benimsenmiştir?,"Öğrencilere öğrenmeyi öğreten, çağdaş yaklaşımlarla dersin derste öğrenilmesini sağlayan, sonucu değil süreci değerlendirme yaklaşımlarını temel alan bir anlayış benimsenmiştir."
Eski programlarda hangi sorunlar yaşanmaktaydı?,"Programlar arasında yöntem ve tekniklerin uygulanmasında birlik, beraberlik ve bütünlüğün sağlanmasında farklılıklar oluşmaktaydı."
Ortaöğretim programlarında kaç çeşit ders 96 derse indirilmiştir?,190 çeşit ders 96 derse indirilmiştir.
Ortaöğretim programları hangi yıllar arasında yeniden hazırlanmıştır?,2005-2013 yılları arasında yeniden hazırlanmıştır.
2012 yılında ortaöğretimin zorunlu eğitim kapsamına alınmasıyla hangi ihtiyaçlar doğmuştur?,"Asgari bilgi, beceri, tutum ve değerlerin yeniden belirlenmesi, esneklik ve çeşitliliğe sahip öğretim programları oluşturulması, temel bilgi ve beceri düzeyinin yükseltilmesi, istihdam edilebilirlik için temel beceriler kazandırılması ve öğretim programlarında sadeleştirme yapılması gibi ihtiyaçlar doğmuştur."
Öğretim programlarının sadeleştirilmesi neden önemlidir?,Bir bütünlük içinde algılama ve anlamayı kolaylaştırmak için önemlidir.
Öğretmenlere ve ders kitabı yazarlarına hangi esneklik sağlanmalıdır?,Sanatlarını daha ustaca icra edebilecekleri ve özgün çalışmalar üretebilecekleri esneklik sağlanmalıdır.
Öğretim programlarının güncellenmesinde hangi faktörler göz önünde bulundurulmuştur?,"Öğrencilerin potansiyel, yetenek, ilgi ve ihtiyaçlarında farklılıklar gözetilerek esneklik ve seviye farklılıkları dikkate alınmıştır."
Güncellenen öğretim programlarının hedefleri nelerdir?,"Ortalama eğitim düzeyini yükseltmek, çağdaş becerilerle donanmış bir kuşak yetiştirmek, 21. yüzyıl becerilerini geliştirmek ve öğrencilerin ilgi ve yeteneklerini keşfetmelerini sağlamak."
Hangi kurumlar arasında iş birliği protokolü yapılmıştır?,Bakanlık ile Türkiye Bilimsel ve Teknolojik Araştırma Kurumu (TÜBİTAK) arasında iş birliği protokolü yapılmıştır.
Güncellenen öğretim programları hangi sınıfları kapsamaktadır?,"Ortaöğretim 9, 10, 11 ve 12. sınıfları kapsamaktadır."
İngilizce dersi öğretim programı taslağı nasıl değerlendirilmektedir?,Talim ve Terbiye Kurulu Başkanlığının internet sitesinde paydaşların görüş ve önerilerine sunulmuştur.
Ders geçme ve kredi sistemi hangi yılda hayata geçirilmiştir?,1991 yılında hayata geçirilmiştir.
2005 yılında yapılan değişiklikle ortaöğretim süresi kaç yıla çıkarılmıştır?,Ortaöğretim süresi 4 yıla çıkarılmıştır.
2004-2005 eğitim-öğretim yılından itibaren hangi dersler arasında ikinci yabancı dil dersi eklenmiştir?,"Anadolu Lisesi, Anadolu güzel sanatlar lisesi ve fen lisesi haftalık ders çizelgelerinin ortak dersleri arasına eklenmiştir."
2009 yılında alan sayısı kaçtan kaça indirilmiştir?,Alan sayısı 7'den 4'e indirilmiştir.
2012-2013 eğitim öğretim yılından itibaren 9. sınıflar için hangi ders ikinci grup seçmeli dersler arasına eklenmiştir?,Kur’an-ı Kerim dersi eklenmiştir.
Hz. Muhammed’in Hayatı ve Temel Dini Bilgiler dersleri hangi tarihte seçmeli dersler arasına alınmıştır?,28.03.2013 tarihli ve 18 sayılı kararla seçmeli dersler arasına alınmıştır.
Millî Güvenlik Bilgisi dersi hangi yıl haftalık ders çizelgelerinden kaldırıldı?,2012-2013 eğitim ve öğretim yılından itibaren kaldırıldı.
Matematik ve Geometri dersleri hangi yıl birleştirilerek haftalık ders saati düzenlenmiştir?,2013-2014 eğitim ve öğretim yılından itibaren birleştirilmiştir.
Osmanlı Türkçesi dersi hangi eğitim-öğretim yılından itibaren diğer ortaöğretim kurumlarında seçmeli ders olarak okutulmaktadır?,2013-2014 eğitim-öğretim yılından itibaren seçmeli ders olarak okutulmaktadır.
Anadolu öğretmen liselerinde öğretmen meslek bilgisi dersleri hangi tarihte seçmeli dersler kapsamına alınmıştır?,12.06.2014 tarihli ve 55 sayılı Kurul Kararı ile seçmeli dersler kapsamına alınmıştır.
1998 yılında genel liselerde haftalık toplam ders saati kaçtı?,33 saat
2010 yılında fen liselerinde haftalık toplam ders saati kaçtı?,37 saat
Hazırlık sınıfı bulunan Anadolu liselerinde 2013 yılında 9. sınıf için haftalık toplam ders saati kaçtı?,40 saat
Sosyal Bilimler Liselerinde 2005 yılında haftalık toplam ders saati bilgisi var mı?,"Hayır, bilgi yok."
Güzel Sanatlar Lisesi-Görsel bölümünde 2013 yılında 12. sınıf için haftalık toplam ders saati kaçtı?,40 saat
Öğretim materyalleri hangi unsurlardan oluşmaktadır?,"Öğretim materyalleri; ders kitapları, eğitim araçları ve öğretmen kılavuz kitaplarından oluşmaktadır."
Eğitim aracı neyi kapsamaktadır?,"Eğitim aracı, ders kitabı, öğrenci çalışma kitabı, öğretmen kılavuz kitabı ile öğretmen ve öğrencilere kaynak ve yardımcı olacak basılı ve elektronik ortamdaki eğitim materyalini, millî eğitimin genel amaçlarının gerçekleşmesine yararlı olacak diğer eserleri kapsamaktadır."
Öğretmen kılavuz kitabı neyi içerir?,"Öğretmen kılavuz kitabı, ders kitabının daha etkili kullanımını sağlayacak çeşitli örnek, alıştırma, işlenen ünite, konu, tema, öğrenme alanlarıyla ilgili internet adresleri, okuma kaynakları ve diğer etkinlikleri kapsayan basılı eseri içerir."
Millî Eğitim Bakanlığı Ders Kitapları ve Eğitim Araçları Yönetmeliği ne zaman ilk defa uygulamaya konmuştur?,Millî Eğitim Bakanlığı Ders Kitapları ve Eğitim Araçları Yönetmeliği ilk defa 1995 yılında uygulamaya konmuştur.
2005-2006 eğitim ve öğretim yılından itibaren ne tür değişiklikler yapılmıştır?,"2005-2006 eğitim ve öğretim yılından itibaren bütün ortaöğretim kurumlarında haftalık ders çizelgelerinde yer alan ortak kültür, alan ve seçmeli derslerin öğretim programları yeni yaklaşımlarla yeniden hazırlanarak uygulamaya konmuştur."
Ortaöğretim kurumlarında öğretim programlarının hazırlanması için kaç ilde komisyon kurulmuştur?,11 ilde komisyon kurulmuştur.
2012 yılında kitap yazım komisyonlarının görevlendirmelerine neden son verilmiştir?,Kitap yazım komisyonlarının görevlendirmelerine son verilmesi sonucunda TÜBİTAK ile protokol imzalanarak ana derslerin öğretim programları güncellenmiştir.
2012 yılında hangi derslerin 9. sınıf kitapları hazırlanarak uygulamaya konulmuştur?,"Ortaöğretim Matematik, Fizik, Kimya ve Biyoloji 9. sınıf ders kitapları hazırlanarak uygulamaya konulmuştur."
Hangi 10. sınıf ders kitabı Talim ve Terbiye Kurulu tarafından uygun bulunmuştur?,Kimya 10. sınıf kitabı uygun bulunmuştur.
2002 yılında kaç ders kitabı yazdırılmıştır?,2002 yılında 47 ders kitabı yazdırılmıştır.
Ders kitaplarının elektronik ortamda incelenmesi hangi tarihte planlanmaktadır?,Ocak 2015 döneminde.
Güzel sanatlar ve spor liselerine yönelik ders kitapları için hangi tarihte ve sayılı Makam Onayı alınmıştır?,06.01.2014 tarihli ve 64520 sayılı Makam Onayı alınmıştır.
Yeniden kitap yazım komisyonları hangi illerde oluşturulmuştur?,"Ankara, Bursa, İstanbul, İzmir, Konya, Samsun ve Trabzon."
2014 yılı içerisinde Talim ve Terbiye Kuruluna incelenmek üzere gönderilen taslak ders kitaplarından kaçı eğitim aracı olarak kabul edilmiştir?,14 tanesi.
TÜBİTAK ile yapılan protokol çerçevesinde hangi tür liselerin bölüm derslerine yönelik ders kitaplarının yazdırılma ihtiyacı ortaya çıkmıştır?,Güzel sanatlar ve spor liselerinin bölüm derslerine yönelik.
Parasız Yatılılık ve Bursluluk Sınavı ile hangi imkânlar sağlanmaktadır?,Parasız yatılılık veya bursluluk imkânı sağlanmaktadır.
Parasız Yatılılık ve Bursluluk Sınavına başvurabilmek için hangi vatandaşlıklara sahip olmak gerekmektedir?,Türkiye Cumhuriyeti veya Kuzey Kıbrıs Türk Cumhuriyeti vatandaşı olmak gerekmektedir.
Parasız Yatılılık ve Bursluluk Sınavı için belirlenen kontenjanın yüzde kaçı Sosyal Hizmetler Kanunu kapsamındaki öğrencilere ayrılmaktadır?,Yüzde 10'u Sosyal Hizmetler Kanunu kapsamındaki öğrencilere ayrılmaktadır.
Parasız Yatılılık ve Bursluluk Sınavına başvurabilmek için aile gelirine dair hangi şart bulunmaktadır?,"Ailenin bir önceki mali yıla ait yıllık gelir toplamından fert başına düşen net miktarın, Millî Eğitim Bakanlığı okul pansiyon ücretinden en azının üç katını geçmemesi gerekmektedir."
Parasız Yatılılık ve Bursluluk Sınavına başvurabilmek için öğrencilerin hangi disiplin cezasını almamış olmaları gerekmektedir?,Okuldan tasdikname ile uzaklaştırma veya daha ağır bir ceza almamış olmaları gerekmektedir.
Pansiyonlarda barınan parasız yatılı öğrencilere hangi tür sosyal yardımlar yapılmaktadır?,"Giyim, kitap, kırtasiye, harçlık gibi sosyal yardımlar yapılmaktadır."
2013 yılında pansiyonlarda yapılan kırtasiye yardımı ne kadardır?,"2013 yılında pansiyonlarda yapılan kırtasiye yardımı 35,00 TL'dir."
Pansiyonlarda görevlendirilen belletici öğretmenlerin görevi nedir?,"Belletici öğretmenler, pansiyondaki nöbetleri sırasında öğrencilere her konuda destek olmakta ve onların her türlü sorunlarının çözülmesinde yardımcı olmaktadır."
Pansiyonlarda en fazla kaç belletici görev yapabilmektedir?,Mevcut mevzuat hükümlerine göre pansiyonlarda en fazla üç belletici görev yapabilmektedir.
Pansiyonların değişim ve gelişim evreleri hangi genel müdürlükler düzeyinde ele alınmaktadır?,"Ortaöğretim Genel Müdürlüğü, Mesleki ve Teknik Eğitim Genel Müdürlüğü ile Din Öğretimi Genel Müdürlüğü düzeyinde ele alınmaktadır."
2002-03 yılında Ortaöğretim Genel Müdürlüğü'nde pansiyonda kalan öğrenci sayısı kaçtır?,55.263
Mesleki ve Teknik Eğitim Genel Müdürlüğü'nde 2013-14 yılında pansiyonda kalan öğrenci sayısı nedir?,70.681
Din Öğretimi Genel Müdürlüğü'nde 2006-07 yılında pansiyonda kalan öğrenci sayısı kaçtır?,34.876
2008-09 yılında Ortaöğretim Genel Müdürlüğü'nde pansiyonda kalan öğrenci sayısı nedir?,90.104
2004-05 yılında Mesleki ve Teknik Eğitim Genel Müdürlüğü'nde pansiyonda kalan öğrenci sayısı kaçtır?,34.459
2013-14 eğitim öğretim yılında pansiyonda kalan öğrenci oranı en yüksek olan il hangisidir?,"Tunceli, %51,5 oranı ile pansiyonda kalan öğrenci oranının en yüksek olduğu ildir."
2013-14 eğitim öğretim yılında pansiyonda kalan öğrenci oranı en düşük olan il hangisidir?,"İstanbul, %1,4 oranı ile pansiyonda kalan öğrenci oranının en düşük olduğu ildir."
Gümüşhane ilinde 2013-14 eğitim öğretim yılında pansiyonda kalan öğrenci oranı nedir?,"Gümüşhane ilinde pansiyonda kalan öğrenci oranı %35,4'tür."
Ardahan ilinde 2013-14 eğitim öğretim yılında pansiyonda kalan öğrenci oranı nedir?,"Ardahan ilinde pansiyonda kalan öğrenci oranı %37,5'tir."
İzmir ilinde 2013-14 eğitim öğretim yılında pansiyonda kalan öğrenci oranı nedir?,"İzmir ilinde pansiyonda kalan öğrenci oranı %2,5'tir."
Ortaöğretim Genel Müdürlüğünde pansiyonda kalan öğrencilerin en yüksek oranla bulunduğu okul türü hangisidir?,"Anadolu öğretmen lisesi (% 30,7) en yüksek orana sahiptir."
Pansiyonda kalan öğrencilerin cinsiyet oranı nasıl değerlendirilmektedir?,Cinsiyet oranının genel itibarıyla % 100’ün üzerinde olduğu anlaşılmaktadır.
2013-2014 eğitim-öğretim yılında genel lise öğrencilerinin verileri nasıl hesaplanmıştır?,Genel lise okul türü olarak bulunmamasına rağmen diğer okul türlerinin bünyesinde öğrenimine devam eden öğrencilerin verileri üzerinden hesaplama yapılmıştır.
Pansiyonda kalan öğrencilerin okul türlerine göre dağılımında ikinci sırada hangi okul türü yer almaktadır?,"Anadolu lisesi (% 23,9) ikinci sırada yer almaktadır."
"Genel liseler, pansiyonda kalan öğrencilerin oranında hangi sırada yer almaktadır?","Genel liseler (% 22,3) üçüncü sırada yer almaktadır."
2002/03-2013/14 yılları arasında toplam pansiyon sayısı ne kadar artmıştır?,"% 111,4 oranında artmıştır."
Ortaöğretim Genel Müdürlüğü'nde pansiyon sayısı 2002-03'ten 2013-14'e kadar nasıl değişmiştir?,"2002-03'te 369 olan pansiyon sayısı 2013-14'te 840'a ulaşarak % 127,6 oranında artmıştır."
Mesleki ve Teknik Eğitim Genel Müdürlüğü'nde pansiyon sayısı 2002-03 ve 2013-14 yılları arasında ne kadar artmıştır?,"% 169,6 oranında artmıştır."
Din Öğretimi Genel Müdürlüğü'nde 2002-03 ve 2013-14 yılları arasında pansiyon sayısındaki artış oranı nedir?,"% 43,5 oranında artmıştır."
2013-14 yılında Din Öğretimi Genel Müdürlüğü'ne bağlı pansiyon sayısı kaçtır?,411
2002-2003 eğitim öğretim yılından itibaren pansiyon doluluk oranları nasıl bir seyir izlemiştir?,Pansiyon doluluk oranlarının değişimi düzenli bir seyir izlememiştir.
Ortaöğretim Genel Müdürlüğü ile Mesleki ve Teknik Eğitim Genel Müdürlüğü pansiyon doluluk oranları hangi yıl hariç birbirine yakın gerçekleşmiştir?,2003-04 eğitim –öğretim yılı hariç.
Ortaöğretim Genel Müdürlüğü'nde son on iki yılda pansiyonda kalan öğrenci sayısı ve pansiyon sayısı ne kadar artmıştır?,"Pansiyonda kalan öğrenci sayısı % 108,5, pansiyon sayısı % 127,6 oranında artmıştır."
Ortaöğretim Genel Müdürlüğü doluluk oranları il düzeyinde en yüksek hangi illerde gerçekleşmiştir?,"Ardahan (% 92,3), Bayburt (% 93,5) ve Muş (% 96) illerinde en yüksek gerçekleşmiştir."
