soru,cevap
Okulda çocukların yönetim süreçlerine katılımı nasıl sağlanmaktadır?,"Okulda çocukların yönetim süreçlerine katılımı, öğrenci meclisi, öğrenci temsilciliği ve dilek kutusu mekanizmalarının aktif ve etkin olarak işletilmesi ile sağlanmaktadır."
Velilerin okul yönetimine katılımı nasıl sağlanmaktadır?,Velilerin okul yönetim sürecine etkin katılımı sağlanmaktadır.
Ailelerin okul ile iş birliği neden önemlidir?,"Ailelerin ve okulun iş birliği, çocuğun öğrenmesinde ve gelişmesinde tutarlı, güvenilir ve koşulsuz destek sağlaması açısından çok önemlidir."
Okul velilerin yönetimine katılımı nasıl sağlanmalıdır?,"Okul, zor, dışlanmış ve dezavantajlı çocukların ailelerinin katılımını sağlamak için çaba harcamalıdır."
Ev ve okul arasındaki bağlantının önemi nedir?,"Ev ve okul arasındaki bağlantı, nitelikli bir eğitimi ve öğretimi teşvik eder ve çocuğun yaşamındaki sorunların fark edilmesini sağlar."
Aile ve veli katılımı neyi ifade eder?,"Aile ve veli katılımı, okulu mali olarak desteklemekten ziyade, ailelerin ve velilerin okulu sorunları ve başarıları ile sahiplenmelerini ifade eder."
Okul Aile Birliği'nin rolü nedir?,"Okul Aile Birliği, velinin kararlara katılımı için en temel mekanizmadır ve velilerin katılımını sağlamakta önemli bir katalizördür."
Okul aile birliği yönetim kurulu gelir-gider kayıtlarını nasıl ilan eder?,Dönemsel olarak ilan edilir.
Okul Aile Birliği neden önemlidir?,"İşlevsel bir Okul Aile Birliği, okul yönetiminin düzenli, şeffaf ve işlevsel olarak çalışmasını sağlar."
Velilerin görüşlerini bildirmesi hangi toplantılarda gerçekleşir?,"Velilerin görüş ve önerilerini serbestçe bildirmeleri, veli toplantılarında gerçekleşir."
Okul-veli sözleşmeleri nasıl yapılmalıdır?,Okul-veli sözleşmeleri amacına uygun şekilde yapılmalı ve izlenmelidir.
Veli temsilcisi hangi yapılarda bulunmalıdır?,"Veli temsilcisi, OGYE ve ŞÖK gibi okul yönetim ve planlama yapılarında bulunmalıdır."
Veli toplantılarının amacı nedir?,"Veli toplantıları, öğretmenlerin ve okulun beklentilerini iletmenin yanı sıra velilerin görüş ve taleplerini iletebilmeleri için de düzenlenmelidir."
Okul öncesi eğitimin önemi nedir?,"Okul öncesi eğitim, temel eğitimden başlayarak üst eğitimleri etkileyen önemli bir kademedir ve çocukların bilişsel, sosyal-duygusal, dil, psikomotor alanlarına ve özbakım becerilerine ilişkin yeterliklerini destekler."
Anaokulu/Anasınıflarında aile eğitimi ihtiyaç belirleme formlarına göre kaç eğitim planlanmıştır?,En az 5 eğitim planlanmıştır.
Okul Aile Birliği'nin işlevsel olması için ne gerekmektedir?,"Birliğin düzenli, şeffaf ve işlevsel olarak çalışma sürekliliğinin sağlanması, velilerin görüş ve önerilerinin toplantılarda serbestçe ifade edilebilmesi gerekmektedir."
Eğitimde katılım kavramı kimleri kapsar?,"Katılım kavramı, öğretmenler, çocuklar, veliler, diğer personel ve ilgili paydaşlar gibi eğitimde hem hizmet veren hem de hizmet alan tüm tarafları kapsar."
Öğretmenlerin yönetim sürecine katılımı neden önemlidir?,"Öğretmenlerin yönetim sürecine etkin katılımı, kararların birlikte alınmasını sağlar ve yönetimin işlevlerinden biri olan 'eşgüdüm'ün hayata geçirilmesinde etkilidir."
Son dönemdeki okul yönetmeliklerinde ne gibi bir değişiklik olmuştur?,"Son dönemde çıkartılan mevzuatlarda, okulun müdür tarafından diğer çalışanlarla birlikte yönetildiği vurgulanmıştır."
Öğretmenler kurulu toplantı gündemi nasıl oluşturulur?,Öğretmenler kurulu toplantı gündemi öğretmenlerle birlikte oluşturulur.
Öğretmenler kurulu toplantı gündemi nasıl oluşturulur?,Öğretmenler kurulu toplantı gündemi öğretmenlerle birlikte oluşturulur.
Öğretmenler kurulu toplantı gündemi ne zaman okul personeli ile paylaşılır?,Öğretmenler kurulu toplantı gündemi en az iki iş günü öncesinden okul personeli ile paylaşılır.
Okul yönetimi öğretmenlerin katılımını nasıl sağlamalıdır?,"Okul yönetimi, okuldaki kurul, komisyon ve yönetsel kararların alındığı toplantılara öğretmenlerin yeterli ve düzenli katılımlarını sağlamalıdır."
Özel bilgilerin gizliliği hangi kavramlara dayanır?,"Özel Bilgilerin Gizliliği felsefi olarak 'mahremiyet', hukuki olarak 'özel hayatın gizliliği' ve toplumsal olarak 'bireysel mahremiyet hakkı' kavramlarına dayanır."
Okuldaki kararlar nasıl alınmalıdır?,Kararların katılımcıların olabildiğince geniş mutabakatı ile alınması gerekmektedir.
Mahremiyet hakkı nedir?,"Mahremiyet hakkı, başkalarının fiziksel olarak bize ne ölçüde ulaşabilir oldukları ve bizim başkalarının ilgi ve dikkatinin ne ölçüde nesnesi olduğumuz ile yakından ilişkili bir kavramdır."
İnsan Hakları Evrensel Bildirisi'nin 12. maddesi neyi ifade eder?,"İnsan Hakları Evrensel Bildirisi’nin 12’nci maddesi, kimsenin özel yaşamı, ailesi, konutu ya da haberleşmesine keyfi olarak karışılamayacağını ve herkesin bu tür karışmalara karşı yasa tarafından korunma hakkına sahip olduğunu belirtir."
Çocuk Hakları Sözleşmesi'nin 16. maddesi neyi kapsar?,"Çocuk Hakları Sözleşmesi’nin 16’ncı maddesi, mahremiyet, aile, ev ve mektuplara müdahaleden ve iftira/kötülemeden korunma hakkını kapsar."
Eğitim ortamlarında mahremiyet hakkı neden önemlidir?,"Eğitim ortamlarında mahremiyet hakkı, okul paydaşlarının özel ve aile hayatlarının, saygınlıklarının korunması ve kişiliklerini geliştirme özgürlüklerinin desteklenmesi açısından önemlidir."
Okullarda kişisel bilgilerin gizliliği nasıl sağlanmalıdır?,"Okullar, kişiye özel bilgileri edinme ve paylaşmaya ilişkin uygulamalarını, herkes için özel bilgilerin gizliliği ve mahremiyet hakkının korunmasına özen göstererek ve her zaman çocuğun yüksek yararını gözeterek sürdürmelidir."
Okuldaki kişisel ve/veya hizmete özel bilgi ve belgelere kimler ulaşabilir?,Yalnızca yetkili kişiler tarafından ulaşılabilir.
Risk altında bulunan çocuklara yönelik hangi tür çalışmalar yapılmaktadır?,Önleme çalışmalarına temel oluşturmak üzere çocukla ilgili toplanan bilgilerin gizliliği korunur.
Eğitim öğretim yılında hizmete ve kişiye özel gizli bilgilerin korunma güvencesi hakkında bilgilendirme çalışmalarına katılan çocuk sayısı neye göre değerlendirilir?,Toplam çocuk sayısına oranı ile değerlendirilir.
Okulda kişisel ve/veya hizmete özel bilgi ve belgelerin gizliliğini korumaya yönelik kurallar nasıl belirlenmiştir?,Yazılı olarak belirlenmiştir.
Okul aktörlerinin özel bilgilerin gizliliği konusunda ne tür algılar oluşmaktadır?,Kişiye ve hizmete özel bilgilerin gizliliğinin sağlandığına dair algılar oluşmaktadır.
Okulda kişiye ve hizmete özel bilgilerin gizliliği nasıl korunur?,Okul paydaşlarının katılımlarıyla belirlenen kuralların uygulanması ve bilgi güvenliğini sağlayıcı önlemlerin işlevsel biçimde uygulanması gerekmektedir.
Temel eğitim zorunlu mu?,"Evet, ülkemizde temel eğitim zorunludur ve bu durum Anayasa'nın 42’nci maddesinde yer almaktadır."
Okula kaydolmamış çocukların tespiti neden önemlidir?,"Okula kaydolmamış çocukların tespiti, temel eğitime erişim sorunlarının çözülmesi için gereklidir."
Okul terklerinin azaltılması için hangi gruplara yönelik tedbirler alınmalıdır?,Başta kırsal kesime ve kız çocuklarına yönelik tedbirler alınmalıdır.
Temel eğitime erişim sorunu nasıl ele alınmalıdır?,Temel eğitime erişim sorunu ulusal ve yerel düzeyde ele alınmalıdır.
İlköğretim okulları hangi yükümlülüklere sahiptir?,"İlköğretim okulları, kayıt kabul alanlarında bulunan nüfusa kayıtlı olan ve olmayan tüm çocukları kaydetme ve okula devamlarını sağlamakla yükümlüdür."
Koşulsuz erişim ifadesi neyi vurgulamaktadır?,"Koşulsuz erişim ifadesi, çocuklarla ilgili hiçbir koşul ya da durumun, onların okula erişimlerinin karşısında bir gerekçe olamayacağını vurgulamaktadır."
222 sayılı İlköğretim ve Eğitim Kanunu'nda velinin yükümlülüğü nedir?,"Velinin, çocuğun okula devamını sağlamadaki yükümlülüğü açıkça ifade edilmektedir."
Okuldan erken ayrılma sorunu neden önemlidir?,"Okuldan erken ayrılma, eğitime erişimdeki ana sorunlardan biridir ve zorunlu temel eğitim düzeyi için çok daha önemlidir."
Zorunlu eğitim uygulaması kapsamında hangi çocukların okula erişimi sağlanmalıdır?,Temel eğitim çağındaki nüfusa kayıtlı olsun veya olmasın tüm çocukların okula erişimlerinin sağlanması gerekmektedir.
"Okul, hangi çocukları kaydeder?","Okul, kayıt kabul alanındaki nüfusa kayıtlı olan/olmayan çocukları kaydeder."
Türkiye'de ilköğretimde okullaşma oranı ne kadardır?,İlköğretimde okullaşma oranı % 99’lara ulaşmıştır.
Okula kaydolmayan kızların oranı erkeklerden nasıl bir durum göstermektedir?,"Veriler, okula kaydolmayan kızların erkeklerden daha yüksek oranda olduğunu göstermektedir."
Eğitim çağında olup da okula gidemeyen öğrencilerin okullaşmasını sağlamak için hangi kampanya yürütülmüştür?,"""Haydi Kızlar Okula"" kampanyası yürütülmüştür."
Okula kaydolmamış çocukların tespitinde yaşanan güçlükler nelerdir?,ADNK sistemine ve okula hiç kaydolmamışların tespitinde yaşanan güçlüklerdir.
"Okul yönetimi, ilköğretim çağındaki kayıtsız çocukları nasıl tespit etmektedir?","Okul yönetimi, destek alarak ve gözlem yoluyla okul bölgesinde ilköğretim çağında olduğu halde nüfusa kaydolmamış ve okula gitmeyen çocukları tespit etmek durumundadır."
"Millî Eğitim Bakanlığı, öğrencilere nasıl ek kapasite yaratmıştır?","Millî Eğitim Bakanlığı, yeni temel eğitim derslikleri inşa ederek, yatılı bölge okulları ve pansiyonlu okullar yaptırarak, üç milyonun üzerinde öğrencinin yararlanabileceği bir ek kapasite yaratmıştır."
Sosyal Yardımlaşma ve Dayanışmayı Teşvik Vakfı'ndan maddi yardım kimlere yapılmaktadır?,"2002 yılından itibaren, en düşük % 6’lık gelir dilimindeki öğrenci ailelerine maddi yardım yapılması uygulaması yürütülmüştür."
Okul yönetiminin zorunlu eğitim çağındaki çocukları kaydetme konusundaki temel beklentileri nelerdir?,"Okulların nihai hedefi, öğrenci kabul sınırları içinde yaşayan zorunlu eğitim çağındaki, engelliler dâhil, erkek ve kız çocukların tamamının okula kayıt edilmesidir."
"Taşımalı eğitim uygulaması yapan okullar, çocuklara ilişkin hangi bilgileri takip etmelidir?","Taşımalı eğitim uygulaması yapan okullar, çocukların sayısı, devam durumu, özel durumlar gibi bilgileri takip etmelidir."
Okula erişim ve devamlarını sağlama açısından ne yapılması beklenmektedir?,En az bir dönem öncesi edinmeleri gerekli planlamaları yapmaları beklenmektedir.
Anaokulu ve anasınıfında hangi yaş grubundaki çocuklar için kayıt kabul çalışmaları yapılmaktadır?,"Anaokulu ve anasınıfında 36 aydan küçük, 36-48 aylık, 49-60 aylık ve 61-72 aylık çocuklar için kayıt kabul çalışmaları yapılmaktadır."
Okula kayıt olmamış çocukların nedenleri nasıl araştırılmaktadır?,Okula kayıt olmamış çocukların belirlenerek okula kayıt olmama nedenlerinin araştırılması gerekmektedir.
Okula kayıt olmamış çocuklar için ne tür stratejiler geliştirilmelidir?,Belirlenen kayıt olmama nedenlerine göre farklı stratejiler geliştirilmesi ve bunların çocukları okula kazandırmada etkili şekilde uygulanması gerekmektedir.
Okula kayıtlı olmayan çocukların kaydolma durumu nasıl takip edilmektedir?,"Uygulanan stratejilerin sonucunda, okula kayıtlı olmayan çocukların ne kadarının kaydolduğunun takip edilmesi ve buna ilişkin bilgilerin sisteme girilmesi gerekmektedir."
Okul devamsızlık nedenlerini nasıl tespit etmektedir?,"Okul, devamsızlığın ve devamsızlık nedenlerinin tespitini zamanında yaparak değerlendirmeler sonucunda bireyselleştirilmiş müdahaleler uygulamaktadır."
Erişim sağlanan çocukların okuldan kopmamaları için ne yapılmalıdır?,"Okulun, çevresel koşullarına uygun önlemler alması önemlidir."
Okul terkleri ve devamsızlık nedenleri hangi faktörlere bağlı olarak farklılık gösterebilir?,Terk ve devamsızlıkların nedenleri yerel düzeyde farklılıklar gösterebilir.
Hangi gruptaki çocuklar okula devamsızlık ve terk açısından dezavantajlıdır?,"Engelliler, geleneksel yapıyı sürdüren bölgelerdeki kızlar, çalışan çocuklar ve sosyal risk altındakiler dezavantajlı gruplardır."
Kız çocuklarının okula gitmelerinin artırılması için ne tür çabalar sürdürülmektedir?,Kızların okula gitmelerinin artırılmasına yönelik çabalar ve kampanyalar devam etmektedir.
Okula devamdan kim yasal olarak sorumludur?,Okula devamdan yasal olarak veli sorumludur.
Devamsızlık sorununu çözmek için okul ve aile arasında ne tür bir işbirliği gereklidir?,Okul ve ailenin işbirliği içerisinde olması önemlidir.
Çocukların devamsızlıkları hangi sisteme girilir?,Çocukların devamsızlıkları her gün e-Okul sistemine girilir.
Devamsızlık konusunda kimler bilgilendirilir?,"Tüm çocuklar, veliler, yöneticiler ve öğretmenler bilgilendirilir."
Anaokulu ve anasınıflarında devamsızlıkla ilgili ne tür belgeler vardır?,Devamsızlığın sağlanması konusunda yapılması gereken iş ve işlemlerin zamanında yapıldığına dair belge/kayıtlar vardır.
Erken Uyarı ve Aşamalı Devamsızlık Yönetimi (ERADEY) kapsamında ne yapılır?,ERADEY kapsamında yapılması gereken iş ve işlemler zamanında yapılır.
Okula dönemeyecek durumda olan çocuklar için ne tür işlemler yapılır?,Okula dönemeyecek durumda olan çocukların e-Okula nedenleri işlenerek okuldan ayrılma işlemleri zamanında yapılır.
Okuldan ayrılma işlemleri neden zamanında yapılır?,Nedenleri işlenerek okuldan ayrılma işlemleri zamanında yapılır.
Devamsızlık önleme müdahaleleri hangi seviyelerde uygulanır?,İlkokulda/ortaokulda risk altında bulunan çocukların okula devamsızlık yapmalarını önlemeye yönelik müdahaleler uygulanır.
Özürsüz devamsızlık oranları hangi bilgileri içerir?,"Devamsızlık süresi, devamsız çocuk sayısı, okula devam eden çocuk sayısı ve oran bilgilerini içerir."
Özel gereksinimi olan çocuklar hangi merkezlerden yönlendirilir?,Rehberlik Araştırma Merkezlerinden anaokulu ve anasınıflarına yönlendirilir.
Okulda çocukların devam durumlarının nasıl takip edildiği hakkında ne tür algılar vardır?,Okuldaki tüm çocukların devam takip işlemlerinin düzenli olarak yürütüldüğüne dair algılar vardır.
Günümüzde eğitim sistemlerinin amacı nedir?,"Günümüzde eğitim öğretim sistemleri, bilgiye ulaşma yollarını bilen, mevcut bilgilerden yeni bilgiler üretebilen ve bilgiyi etkili biçimde kullanabilen bireyler yetiştirmeyi amaçlamaktadır."
Okul öncesi ve ilköğretimde başarı ve verimlilikle ilgili hangi sorunlar bulunmaktadır?,"Sınıf mevcutlarının kalabalık oluşu, eğitim ortamlarına ilişkin yetersizlikler ve personel nitelikleri gibi alt yapı sorunları ile yönetim ve eğitim-öğretim süreçlerindeki yetersizlikler bulunmaktadır."
"Bakanlık, eğitimdeki dönüşüm için ne tür çalışmalar yapmaktadır?","Bakanlık, öğrenci merkezli eğitim modelini geliştirmeye yönelik ARGE çalışmaları yürütmekte ve okullara destek olacak kaynakları geliştirmeye çabalamaktadır."
Öğrenci merkezli eğitimde ulaşılması hedeflenen temel beceriler nelerdir?,"Türkçeyi doğru, güzel ve etkili kullanma, eleştirel düşünme, yaratıcı düşünme, iletişim kurma, problem çözme, araştırma, karar verme, bilgi teknolojilerini kullanma ve girişimciliktir."
Öğrenme ve Öğretim Alanı Standartları hangi anlayışa uygun olarak belirlenmiştir?,"Öğrenme ve Öğretim Alanı Standartları, öğrenci merkezli eğitim anlayışına uygun olarak belirlenmiştir."
Çocukta çevre bilincinin geliştirilmesi için hangi materyaller kullanılır?,"Öğrenme materyalleri, bilgi iletişim ve eğitim teknolojileri kullanılarak çevre bilincinin geliştirilmesine katkı sağlar."
Okuldan ayrılan çocukların hangi temel bilgi ve becerileri edinmeden ayrıldıkları belirtiliyor?,"Temel bilgi, beceri, tutum ve değerleri tam olarak edinemeden okuldan ayrılmaktadırlar."
Klasik eğitim sürecinde öğretmenin ve öğrencinin rolleri nasıldır?,"Öğretmenin rolü etken, öğrencinin rolü ise edilgendir."
Geleceğin yetişkinleri olarak çocuklara hangi tür bilgiler kazandırılmalıdır?,"Temel bilgi, beceri, tutum ve değerlerin kazandırılması gerekmektedir."
Öğrenci merkezli eğitim modelinin temel amacı nedir?,Eğitim süreçlerini çocukları merkeze alarak oluşturmak ve çocukları süreçte aktif kılmaktır.
Sınıf uygulamalarında çocukların hangi özellikleri değerlendirilmelidir?,"Çocukların her boyutta gelişim, öğrenme, kişisel özellikleri ve ihtiyaçları değerlendirilmelidir."
Çocukların eğitim ortamına uyumlarını sağlamak için ne yapılmalıdır?,Eğitsel rehberlik yapılmalıdır.
Özel eğitime gereksinimi olan çocuklar için hangi düzenlemeler yapılmalıdır?,Topluma entegrasyonlarını güçlendirecek ve akranlarıyla birlikte eğitim almalarını sağlayacak düzenlemeler yapılmalıdır.
Eğitim kurumları öğrenme süreçlerini nasıl planlamalıdır?,Hizmet verdiği çocukların ihtiyaçlarına ve özelliklerine dayalı olarak öğrenme süreçlerini planlayıp yapılandırmalıdır.
Eğitim süreci planlanmadan önce ne tür değerlendirme çalışmaları yapılmalıdır?,"Çocukların bireysel özelliklerini, öğrenme ihtiyaçlarını ve ilgi alanlarını tanımaya yönelik değerlendirme çalışmaları yapılmalıdır."
İnsan gelişimi hangi iki faktörün sentezi olarak ortaya çıkar?,Kalıtım ve çevrenin sentezi olarak ortaya çıkar.
Çocukların bireysel farklılıkları neden önemlidir?,"Çocukların bireysel farklılıkları, onların farklı eğitsel ihtiyaçlara sahip olmaları ve farklı yollardan öğrenmeleri nedeniyle önemlidir."
Eğitimde bireysel farklılıklar nasıl ele alınmıştır?,"Eğitimde bireysel farklılıklar, son 15 yıl öncesine kadar çoğunlukla rehberlik uygulamalarının bir konusu olarak ele alınmaktaydı, ancak günümüzde eğitimin tüm süreçlerinde uygulanması gerekmektedir."
Çocukların bireysel özelliklerinin tanımlanması neden gereklidir?,"Çocukların bireysel özelliklerinin tanımlanması, öğrenme-öğretim süreçlerinin etkili planlanabilmesi için gereklidir."
Özel eğitime ihtiyacı olan çocuklar için ne yapılmalıdır?,"Özel eğitime ihtiyacı olan çocuklar için bireysel eğitim programının hazırlanması, uygulanması ve değerlendirilmesi gerekmektedir."
Anasınıfı/anaokulunda çocukların bireysel özelliklerini tanımaya yönelik hangi kayıtlar kullanılmaktadır?,"Zümre öğretmenler kurulu kararları, çocuk ve aileyi tanıma formu, portfolyo dosyası gibi kayıtlar kullanılmaktadır."
İlkokul/ortaokullarda eğitim öğretim yılında hangi değerlendirmeler kullanılmaktadır?,"Çocukların bireysel özelliklerini, öğrenme ihtiyaçlarını ve ilgi alanlarını tanımaya yönelik değerlendirmeleri gösteren kayıtlar kullanılmaktadır."
Tüm çocukların öğrenmeye hazır bulunuşluk düzeyinin belirlenmesine yönelik ne tür kayıtlar vardır?,Tüm çocukların öğrenmeye hazır bulunuşluk düzeyinin belirlenmesine yönelik kayıtlar bulunmaktadır.
Zümre öğretmenler kurulunda çocukların bireysel özelliklerini tanımaya yönelik kararların sayısı neye göre değerlendirilir?,"Eğitim öğretim yılına ait zümre öğretmenler kurulunda çocukların bireysel özelliklerini, öğrenme ihtiyaçlarını ve ilgi alanlarını tanımaya yönelik kararların sayısına oranı ile değerlendirilir."
Okuldaki aktörlerin bu alt standart için hangi çalışmaları yapması beklenmektedir?,Çocukların gelişim ve öğrenme ihtiyaçlarını belirlemeye yönelik çalışmaların yapılması ve bu çalışmaların planlamalara uygun yürütülmesi beklenmektedir.
Çalışmalara kimlerin katılımı sağlanmaktadır?,"Öğretmenlerin, velilerin ve çocukların katılımı sağlanmaktadır."
Öğretmenler çocukları tanımak için ne tür çalışmalar yapmaktadır?,"Öğretmenler, çocukları tanımaları için farklı çalışmalar yapmaktadır."
Bireyi tanıma çalışmalarında hangi araçlar ve yöntemler kullanılmalıdır?,"Bilimsel geçerliliği olan araçlar ve yöntemler, kurallarına uygun şekilde kullanılmalıdır."
Yapılan çalışmaların sonuçları hakkında kimlere geribildirim verilmelidir?,Çocuklara ve velilere geribildirim verilmelidir.
Bireyi tanıma çalışmalarında bilgi güvenliği neden önemlidir?,"Çünkü bu bilgiler, çocukların ve velilerin özel bilgilerini içerecektir."
Sınıf içi öğrenme etkinlikleri nasıl planlanır?,"Sınıf içi öğrenme etkinlikleri, çocukların özelliklerine ve öğrenme ihtiyaçlarına göre eğitim/öğretim programlarının kazanımlarını destekleyecek biçimde planlanır."
Öğrenci merkezli sınıfların temel odak noktası nedir?,"Öğrenci merkezli sınıflar, öğrencilerin bireysel olarak öğrenmeleri üzerine yoğunlaşmıştır."
Öğretmenlerin rolü nedir?,"Öğretmenlerin rolü, öğrencileri ilgi alanları ve gereksinimlerini göz önüne alarak, ilerlemeyi kolaylaştırarak öğretim açısından rehberlik yapmaktır."
Gelişimsel odaklı kazanımlar nedir?,"Gelişimsel odaklı kazanımlar, çocukların öğrenmelerine yön gösteren referanslardır."
Aktif öğrenme yöntemlerinin amacı nedir?,"Aktif öğrenme yöntemleri; çocuğun bilgiyi edinme, bütünleştirme, işleme ve hatta yeni bilgiler üretmesini hedef alır."
İlköğretim programlarındaki kazanımların gelişimsel olarak ne kadar çeşitli olduğu nedir?,"Kazanımlar, zihinsel boyutun ötesinde, çocuğun yaşamının pek çok farklı boyutlarında kazanımları içerir."
Eğitim öğretim yılı başındaki mesleki çalışmalarda hangi kayıtlar vardır?,Eğitim/öğretim programlarının zümre öğretmenleri tarafından incelenip değerlendirildiğine dair kayıtlar/toplantı tutanakları vardır.
İlkokul/ortaokullarda yıllık ders planları nasıl hazırlanır?,"Öğretim programları, çocukların gelişim özellikleri, çevre şartları dikkate alınarak hazırlanır."
Anaokulu/anasınıflarında aylık planlar nasıl oluşturulur?,"Çocukların bireysel özellikleri, öğrenme ihtiyaçları, ilgi alanları ve çevre şartları dikkate alınarak hazırlanır."
Eğitim öğretim yılı sonunda zümre toplantılarında ne değerlendirilir?,Eğitim öğretim programlarının uygulamasına dair süreç içerisindeki eksiklikler ve öneriler değerlendirilmiş ve kayıt altına alınmıştır.
Öğretmen Kılavuz Kitabı olan derslerde öğretmenler ne yapar?,"Öğrenme etkinliklerinde öğretim programları, yıllık plan, çocukların bireysel özellikleri, öğrenme ihtiyaçları, ilgi alanları ve çevre şartları doğrultusunda yaptıkları değişiklikleri öğretmen kılavuz kitaplarına not eder."
Okuldaki aktörler hangi temel üzerine farklı sınıf içi öğrenme etkinlikleri uygulamaktadır?,Yönetici ve öğretmenler program kazanımlarını temel alarak.
Sınıf içi etkinliklerin yapılmasında hangi görüşlerin alındığı belirtilmiştir?,Çocuk ve diğer paydaşların görüşlerinin alındığı.
Ders araç gereçlerinin çocukların öğrenmesine nasıl katkı sağladığı ifade edilmiştir?,Ders araç gereçleri çocukların gelişimleri ve kalıcı öğrenmelerini sağlamada yararlıdır.
Öğretmenlerin hangi tür planlamalar yapması gerektiği vurgulanmıştır?,Çocukların bireysel özelliklerine ve öğrenme ihtiyaçlarına göre uyarlanmasına yönelik planlamalar yapılmalıdır.
Öğretmenlerin öğretim programlarını nasıl uyarlaması gerektiği belirtilmiştir?,"Öğretmenler, öğretim programlarını çocukların bulundukları çevre ve öğrenme ihtiyaçlarına göre uyarlamalıdır."
Sınıfta hangi öğretim yöntemleri kullanılmalıdır?,"Sınıfta, çocukların bireysel amaçlar ve planlar oluşturmasına, bilgiyi ve öğrenme stratejilerini seçebilmesine, kendi öğrenme sürecini değerlendirebilmesine yönelik etkinlikler yapılmalıdır."
Öğrenci merkezli öğrenme ortamında en önemli iletişim kanalları nelerdir?,"Eğitim ve öğretim materyalleri, öğrenci merkezli öğrenme ortamındaki mesajların öğreticiden öğrenene iletilmesindeki en önemli kanallardan biridir."
Okulöncesi eğitim ve ilköğretim programları hazır öğrenme materyalleri kullanımını öneriyor mu?,"Hayır, okulöncesi eğitim ve ilköğretim programları hazır öğrenme materyalleri kullanımını önermemektedir."
Özel eğitime ihtiyacı olan çocuklar için hangi tür eğitim materyalleri mevcuttur?,"Anasınıfı, anaokulu, ilkokul ve ortaokulda özel eğitime ihtiyacı olan çocuklar için uygun eğitim/öğretim materyalleri vardır."
Öğretmenler eğitim materyali tasarlarken ne tür materyaller kullanır?,Öğretmenler özgün eğitim/öğretim materyali tasarlar ve etkinliklerde kullanır.
